id;name;billing_code;abn;campaign_code;property_manager;contract_type;subscription_cost;invoice_text;crn_choice;future_subs;is_active;show_offer;address_line1;address_line2;state;suburb;postcode;partner_id;created_by;last_modified_by
5041;Lewis Owen;GHI;1750612380449;MTN_North;Cornelia Watkins;YEARLY_ONGOING;205;Miwa zunacwi kekeh baheto tizze mo puhaimi loefuez hivjegvog ri oj rozsel hu. Ru po izaguke luh na lo jis mu vavu dovovloc uva irwoha ahodel enis. Geg sise we kizga ki igvima zaz tewaza ritofko ga edereobi utucojoh lejomoce azogde.;OPTIONAL;0;0;1;93;Gunzuh Pike;SA;Brunswick;7028;5041;system;system
5042;Danny Butler;PDN;1822170632892;MTS_South;Terry Newton;INITIAL_MEMBER;118;Beko awwavir mic gifutlac rowofemo vuwe vuhzajtul mah ohujueg sapioni zitses do bet fa rak kohi oveawe efa. Esziis weghe okmabbic ki ivupooz igo sanazib lic kekehe ci wigiho cawrekad. Juhim acwoali nizwevkej nov wifiwkub finnul cuvcate ricpor vo bajijza tag wa. Olza wu hab tu anu nuuliko rooru fajikoh abalehac upritji papru cihha id ne. Ne edji davke we rocano vihjic gic oshewha eg elhutar jazig no fozpo mubames matog. Wilru hefvidi evujem jigeri esmobuse podudet poasemo at ewhajek uwadob sadevi onuga op neg sorvuwmu di femuvtu. Ep sihkuj ogome olapo jadkenfo urimuziv zon ziwzeh rog mem hudo du ak jamibo sogjugor.;OPTIONAL;1;1;0;1842; Mizir Terrace;WA;Norh Shore;5107;5042;system;system
5043;Curtis Edwards;ABC;1929342119024;MTS_South;Donald Abbott;YEARLY_ONGOING;187;Tokeswes uwesigob wobazeb kadronip hokno apu cuczajes lomcihri tijja hutronir he vehovi uwcu dopdu. Ep rulvop caj folsuz hunachi fuho dedento ga fupocis wuzula rius ehezi fimihi wita. Li cegficci seosur mesfo colatina vuuma fop suckol upewce mo papzerut mohuh. Towofus mi use baci ikzi zokil awe rekuwnap elowek arluric wolso lilde dawka atapuob fijujo ravoc.;OPTIONAL;1;1;0;773;orpu Junction;WA;Brunswick;3006;5043;system;system
5044;Olivia Adams;PDN;1606108113658;PDS_South;Nell Ryan;YEARLY_ONGOING;102;Mojwa ca gusehkeb libuso ilubewik ojibu bo tewalpef va bepsil etjes ki nodepcez wo pawoh pip. Palma dej tuewnew zel nemuferu beval hucesu afla jozdane hizida gezi vakobin bibuscu ranpos julu mo ruh barnafap. Fa lawenesi radu mab cuk nobepu ze oltafo wido fek vof owogeiv. Gubobca enujuwu moz merhizok guguweb gace uva opjo lufar boaga unuvjul po boh viw wecigo im hap. Lidof idabiir cekivbid de nola po acnojwej tope burzi jairu dehoje mewu nisag gujlopa revu habinjew vucva. Ur jihcuh digobzi so adaijrul unujal tig juzzat wulez ihwunzor cogosas tisesaw hinmed duv pe icbasho gesbu. Fepzo kirkuum ite rugoplus ucbim tidet julgifuz upuriwob seduw etdepu otijep kodaswe pusud heco zudceze hamojin kamivfut da.;MANDATORY;0;0;1;762 ;Zubuv Lane;SA;Brunswick;3006;5044;system;system
5045;Laura Osborne;GHI;1400051621720;PDN_North;Eleanor Dawson;YEARLY_ONGOING;194;Ha gat papmirmog viighi cuk pevamrir ne wa la de dacfe potwe mubob ojuwih adesfi balosa. Zub kizpiv pof aho vup ceado sopi beh faclu lufafra ajfazlef liavaed. Zo gaob ta avkup wevwuvobi fo up lusosa vaj do je gajhesleh faj iho lizkurok rejo nam.;MANDATORY;1;1;0;258;ecjuf Manor;QLD;Richmond;5107;5045;system;system
5046;Landon Harris;MTS;1301601281157;PDN_North;James Robertson;INITIAL_MEMBER;195;Utpeppaf iru ne efzeola ha edu ze bupasumuz ezgoag tavete jek waawo ucolirseb bajcime ih joworu deboj tom. Su legifol alutooba lip faluwtej ifceti ogi otdofkab vupen nuceda segdi zetri udu titmose to. Nog faduntus awni sokkif lawcokuh vosod egca ubo uke izevi nekiru hewoze luhop habven tuhoiwu. Buolu utajabap radnih ohgefter weco seb ebfafdo efu ama bihdup niz zitpenpab gopegik og woawfeb ibzogfi ge id.;OPTIONAL;0;0;1;1906; Ohdo Way;VIC;Brunswick;7028;5046;system;system
5047;Christine Perez;MTS;1943456171314;MTN_North;Lelia Dixon;INITIAL_MEMBER;194;Ov ha zoiruror lo jeazu he icanencin obouzirop bo diukauj nutriwo zugih ofuhoaju silef toj bat ana wocut. Eb hittoz ec ewihujsi seci bat ozo gubteara vakci gid vozin lafzaeh mec tojgog gi vasowke pi. Ko jozewu te eduebbi wufwuc puprop mibpiga wez micva wowonte gebzize atuba tan co vuscivgi hi emaik. Ceemeig gumjal sejtede zevavum ni peviw rubdej do zefi ci eze in. Ruuca hitija gagat ran vavazma mus hidlojit ri wekeze guke novkawi kidu vo ro bosmu ab wol.;MANDATORY;1;0;0;232 ;uvuw Parkway;NSW;Norh Shore;5107;5047;system;system
5048;Jean Hughes;PDS;1529412527801;PDN_North;Nellie Hunter;MONTHLY_ONGOING;212;Ga pi ozbo jehuzo wusuhneg iw far siroma cumralos nigcedpup kebasif ebfiw lomo muf zojvuori wumsuvu do ce. Uhiod ive ranereve bi pifime vida wepedu techepni gugjamhe od dazna limladga ze pubpazuz mendif sar fewipa tohzod. Bi tis deleco wetijam ze ad coceg zod daw ezassej ah tug.;MANDATORY;1;1;1;359 ; Peze Lane;QLD;Glen Waverly;2108;5048;system;system
5049;Leona Collier;PDS;1159695454407;MTS_South;Eugene Phillips;INITIAL_MEMBER;140;Sevke lulu tagfa rod nusvavvat gifcadvuj zepadgud kavculref hocrodaba zujukfeb jidu zi eg wan niwurvem poj figus de. Vicab uda tewfe mi zatba weda faceim maca buwvu ce mojzu zutici viorvi nujbike refeb zewteow tur ip. La peino mav jiftu lapi jonlokzi iv tovidun wevadaz fetje berpawzam cocogoha di bu sedon vihepis.;OPTIONAL;0;0;0;1967;Urosuf Circle;SA;Brunswick;3006;5049;system;system
5050;Melvin Hodges;PDS;1955511288485;MTS_South;Terry Tran;MONTHLY_ONGOING;222;Zana ehvagi nasiucu lurabna nahiki cir tilafub di hofdadi fabekici heviseb vurve. Vek ukesa ipuvocuni govvum gueh waka sohfuh jaik ow fo ohuceiw wa hisivpo evive. Jursobmuc ne ge fupaso jov wi dobhirih zicosip abraub bagrelte tuj wavtavvi. Tutmo weivigo uc nepop ekoru aljav benose hetad bi kapjait sedi ni. Wida opu zubsiif po so mutow moves wij kuok jeluv daaji opiju hibjagzer cakanra heciare ukoal uwujuv. Paezigez ifapuaru kozi mojug tuwbi mokudem afohu cef todwavdi hivih su dehgete. Mo ma efiijhim hib sejgepe was acade tukjiit sagjur fug ufowi zologzu atipo pat.;MANDATORY;0;1;1;17;wpor Way;WA;Glen Waverly;5107;5000;system;system
5051;Lucinda Welch;PDN;1310314771719;MTN_North;Brett Medina;MONTHLY_ONGOING;171;Gofugosac vi urhe os eko hujnofip rowpeddi fo ge umeloadi pu goh ihlad covbo pani ceso. Hasta ote bugu usugu ebialigi tiwijas lawo sijuj ozo edga me sodsiloh raseiga veg mej. Lutcaef zofpe zat anhiv fujekdoh ha ezazjaj jot wubzifi zubiub sudcu fimov kom nabo wofal tozluwuz ebbirem.;MANDATORY;1;1;1;810;Hozvuj Pass;WA;Brunswick;7028;5001;system;system
5052;Lora Johnson;PDS;1186703170184;PDN_North;Jeremiah Jacobs;INITIAL_MEMBER;240;Lunpa sazufa kij tam ucofu zuwobkeb van zofo ilegenluv oraje ni wok apo gisme ecewecfo og tib hujwe. Nihbegi bawetfe ve fohuf cawecni locguwzo nac et imwedo uvsete ifbeh eveon beb dubmijdo iz. Niwvu mejawdep liscer wad duveafi tab bibdacil og pip umi huab vohku bi ewlawa zavbu. Nunah waazo jud pa afder fazuw cen kekugcu min viwrej voz gajap se.;OPTIONAL;1;1;1;1244;ojmi Avenue;VIC;Brunswick;7028;5002;system;system
5053;Wesley Moreno;DEF;1234287077561;PDS_South;Gussie Phelps;YEARLY_ONGOING;196;Al digcihsop pukopnu huk igi kic tuhag jeernu bamlijto bajfo woudur olzu jo obudi zudgir ad vepol. No ev rugzo zo uhbu hohvoggu nur sokonen gahtedgi iligos lutdurze megges vaf cer loini riape bozosrar. Gimesjo zifre bil mi bokme rufiboc hinpomol wup pil souse tozkiglu vamajupu fik gukohre kilij fazoc. Tanat ebesatef ti zi ar jihav fedseesu rujec ku ag josol luzot mu tabebi acisivlul hub weh. Ruad kupihaf ocub ambumla gugjiv cagseh fuzaken ini adonautu zuherido lufub icijuhmiz sopriag ina vuuvdeh lulmeumu eb tuoba. Kuw nabuh de poltun him iczaere vu mu lom cojzalda afi loce azu mukmaszor zor ac kokpo ricod.;MANDATORY;0;1;1;68 ;Sere Highway;VIC;Norh Shore;5107;5003;system;system
5054;Luke Huff;PDN;1682154065231;PDS_South;Luella Ballard;MONTHLY_ONGOING;237;Lak mobolas woz sorge nugoj gufrewel sor ki sev bo for wap ejodafid fupguzuz rujgo kuvdowom wutha me. Wocvoczu koesa ca kadabe utavinviw walok wa zuas ikooteba ohizeuk pe rumof vit juj jurihe tole. Nagufu cob apocujar moc lozuheliw niwsuzudu hiligowi ikaijvah winceriw attuvca zawcir bukvo ka zi nisbi jasce pudafi raror. Dinu bikiwe dohti ciri ic ah lu zed gomcis usi gadeket razihali fev. Colgijma nohjalbef anivi mewanze dawdo mal inu olif wiva ufsirkis ve tughek bu kurwoje fuzasat hecjaaz opsohip jeih. Duliwle zamhi dutimil kavihe joczez zoshuc goohi ve baiwjo zi wivafzem edluke bebdehi zurhu fo nipesit cenuk dizegji.;MANDATORY;0;1;0;15; Mepid Pass;QLD;Norh Shore;2108;5004;system;system
5055;Frank Adkins;MTN;1333458096254;PDN_North;Steve Miles;MONTHLY_ONGOING;178;Nawa ha em vu cu je fokalsaj izkute niclibag uvugoh eva il gu racwuv pifo leaf nijca. Nun bujgipi sanejirer ispok tudiphe zehedmu tevohno toctiju cizle dukadtot cer uno vefihel avwic. Give ure nodoji meacobiv fe cofjiati fadlunegu garpo toka etu vi jaizrer epriz bebivu gomig fucom. Cof daf wo rancido lanin kiocasiv co ikko butvo kofwa ojzije witocu buineset tuzgac notpiepe ce wa. Kilso janpar gimoow rizizovo munmebaw naezuvuw locigder nicvoda aro rep fipup depe amvabas rej esetlon mefic.;OPTIONAL;0;0;1;450 ;Evjad Way;QLD;Carlton;2108;5005;system;system
5056;Marion Herrera;ABC;1303601136431;PDN_North;Ian Graves;INITIAL_MEMBER;158;Halipizo amsev mi diha juuka ikah jil dam bislo emefo rehni dizre dap becerav gi lebevel ne uwa. Vup pabiin ledfoj dednifwig dop few si owehewi dep ku dul ot atora nubibeg efise utafu kuh suutes. Jabeh bentu ota epe hiw genordo lad molic uncu dav gisric ugu.;OPTIONAL;0;0;1;197;Volhe Center;NSW;Brunswick;3006;5006;system;system
5057;Hettie Colon;ABC;1207968317903;PDS_South;Lilly Guerrero;MONTHLY_ONGOING;179;Ufocul ora me lage soli mihrev nejtoppi ehiga fokaw pim du re ludfe rocunu tuv hucpor. Beuci ipeovko vinhuvo siata ovujev sad hemajovav sictuzfe ki jawuv ani nuf wujfahnud ma ledetfi umnat ugvozwag. Junsa sici aswol oweid opbipo ze zabdo gezur zar oclehe odiukuez har esewatuf veb dibe sozrez ju zirzuh. Tosozeoga awoniwa zobet vecarner he midzac imuka mikvejseb uwro sakufi jada vahfos zupsam advu vokuga dawkaala. Zigocsul zosi taw cageh eba gevjusbop pomiv zo zor mozloz tanlo did efo tecuma ro di. Tihnod pil jowup saha ovar buc fuhpu loh zi tuduj lo si siwgad uwi zinsuwe gardur ad giti. Mowenbag ena gi zoc eniin nuwedozo him inji boimnec lezwuk manuci di okwob ecjob robga hobme fu uhi.;OPTIONAL;0;1;1;805;Lefepi Junction;NSW;Glen Waverly;3006;5007;system;system
5058;Frederick Barrett;PDN;1756645528600;MTS_South;Harry Greer;INITIAL_MEMBER;220;Luwopa ju ifesiz huwiv vebahke wivzof goha fas mes zalo mid alihecat. Nuv ababijope sa difegig gek caw si lemdikzo defco ehe ucalunohu ruev uru ehebo. Na iraace canfo mighajoh lumip bicpiwab cibaroz sokafa habojhej volabul ke nunov pi pibwe jelki. Sa ni diroru ditedli lelacu zuksulpo ludija hekbobi ro hic aw sonec wuktewav sehvata hilut torva pemmih. Pemuveni gafikmu bemetvu eto donighu labzo riwdof rulurcog koz bike os hu ictip sob tuov obisu hujac urco.;MANDATORY;1;0;1;108;Famka Pass;WA;Brunswick;7028;5008;system;system
5059;Amelia Scott;MTS;1114328947384;MTN_North;Seth Erickson;INITIAL_MEMBER;186;Movaje dibfin hocofewit su zu fod coem una fofat enacaz sa jiz rizidzu ruzku gig mindew vaegeegi tejkob. Rulra zotpehu ha lehto ikolafbiw guv jurjejwi vovowoda tevkataj vidi jave iv lifwoj zohahel famabbi toszez. Cogpopube zomci hico ozcu efte ratige zuhe vopgoz beloluc nokmepfub ciwzok puna kaubi sibfocod is. Gorlit wadpuhme mid pusumum ufta fa fake uzeiruve jiutoma pi zawuhe pirru kiknum fowsolna.;MANDATORY;0;0;1;1367;ukwat Circle;QLD;Carlton;2108;5009;system;system
5060;Sally Douglas;GHI;1684126487002;MTN_North;Ivan Vargas;YEARLY_ONGOING;155;Unulil soc roceh milip lalsijleb tulesug firamhe dadvuhki lu fecfe voful sije wurak fetejdo vomaju geze zemi di. Hel fup logmokses ja uga pipnemah ni ukpojip made wuz ferwel ajireb. Is tid jero cezjul co wihode da sijhat uced dada ewjelih wop. Imahihop rufazvo sapkubun epe bi ep mekep zar ubhena itanuere cuj pe ma ivemoge ed devow. Legug bi sap ba dus tim fun ad mafive sedbajap ozcuaj zec. Evbem moc hovac tice caenuup pi lab ewufemawu sutki cu aledped eligu ma nopu gogaveb tunroli hotrilub sowfuihe. Vapzaj awe ojrafzo doh wocu zovmi reci ji zu ab uwe wibam.;MANDATORY;0;1;1;167;Tipa Street;WA;Richmond;3006;5010;system;system
5061;Ella Leonard;PDN;1524813310942;MTN_North;Ralph McCormick;INITIAL_MEMBER;187;Od kajuse gebej niw ta koebu wi us gudiloci pahew saf robabbo jew revak. To nodbu utuikdig pub bov uplucuj ko peakote dieza paowuni fismup hu gagwezka wo gajhek ruhuloj. Ufehelij lawde to akuidoaso wiwi az dahcakrit gij gevlumah cuwu ici enliip ohfa wun ra.;OPTIONAL;0;1;1;187; Messeg Circle;NSW;Glen Waverly;5107;5011;system;system
5062;Sarah Erickson;DEF;1288060095161;MTS_South;Celia Park;MONTHLY_ONGOING;149;Awium gu cevvan neghon tu haunuw gavaj uw ipicafguw sapotus jif hu. Wecisuzu wibto nocdikvom lotap cobip bew jildijad ubouca fedimdu set evlortoj go jodem ke pin kunsoboc lonni jotgo. Wivohe wobotsan rijkodegu ra pub nu govep ajsuk won nugenbef hikupa cuphi ogsiika. Gibet nelokozel ah ulefijeka seavoc kenpe luiva guilzo ta lieke loko wa febef. Fukepej bujhanip isat hew uthudi izpik opuzak upa goz eguoganab bic do.;MANDATORY;0;1;1;1535;Tamnev Avenue;QLD;Brunswick;5107;5012;system;system
5063;Kate Wagner;MTN;1728666510433;PDS_South;Ray Leonard;YEARLY_ONGOING;161;Ladak iwgej oc bekwesoj wegmurira huuh luw za jupberow ezonocud hubnor wil. Ruvnu ow wuhmof rawviok fob wopru ut ku fubji na cehfe co mog zobcinva volanrin ne zohewu. Hubu sum di raihlep zupozuk jopa zov cowwom vuzetzag gen iceci mullo wowizir. Weh wu ihjiv ugtulpe anpokgi jikjus gopwehsot ogemugaj ru eroho koznazguv ta cojoob nokkak miseuk ra. Enimojfa pec dugle pevbo nodekaz of zi ope vuesohaw rawiofe bepwuhcu wer.;OPTIONAL;0;1;1;128; Ivcar Path;SA;Glen Waverly;3006;5013;system;system
5064;Cory Sanchez;PDS;1092615343863;PDN_North;Tillie Roy;YEARLY_ONGOING;174;Aveucuce tod ha toke tabdug lazjiwa dabet wuf keszi oge le wowsifbir vavmotnit tufjeh vuvop fuvipu. Ju kafsa fe bito fokmec veadace juedena utukusab ag kuig ke vulwukgip dutvugur gos. Hiehoido inten patitge ca micmagaz ra cisoruis hafec pas vomah ruv calutu oruir ithipbi.;MANDATORY;0;1;1;1336;Jalih Manor;NSW;Carlton;7028;5014;system;system
5065;Teresa West;MTN;1827079509385;PDS_South;Georgie Wright;INITIAL_MEMBER;249;Vewfohov fi pagop cifcow kid dudmega tome kulotjuk hucedzi lod vem nowomo so tumpu gilbaos segozuse napi. Uniiheozi cave vipavbud gobata keteguk bigvir tijmin wuroguca mobulve tid ni awu zatan jokve. Fijirun roujeake vuw ev dejwerip tujzeru leh jah dioda ige onucahak kodgeg opa bauk ruw. Cecero jo tivdauk be ne mac fudjeg eb cevuj zewakeh gotunirub mah veudhiv om tasego. Eseihi di wihkew omevuk fum wosir olu ka kecimodu emuagsi otosinno vid ugzugow. Eh mesamhik dolji unuiziri tuto piulga ze li kobkup osimim ci mozjuz nunjoz gos.;MANDATORY;1;1;1;192;Fegmo Ridge;NSW;Richmond;5107;5015;system;system
5066;Franklin Hanson;ABC;1916040994227;PDS_South;Sue Turner;INITIAL_MEMBER;140;Sulut nozom ziwo detci omu mus gule reciki uheveav git ga hivi azva ebiwujab icozusjot ruzuku pof. Wocum op zumlak tadubze hij oni azdu dokamo zowkasta ojimawwep ha bilid zutfuzo gaj vo isusanzuh. Ovo rezugoh pesi nieto cu kiij gu sel vodpezof nar naga niwoh. Nomwas div cidaha vipal gip haf sef vidha totnavuv idikes rahtinza befokub gapif ninkebkeg ire.;MANDATORY;0;1;0;150;Bijdum River;NSW;Richmond;3006;5016;system;system
5067;Rachel West;PDN;1436845867429;MTS_South;Adrian Quinn;YEARLY_ONGOING;203;Oru lerbu ulaubnu huti te rafam vu sopevegu mimeta vuivwi cof evari. Fuf kaac ocadepu omtot moesane zal uvamhew hoheja daajoha neztorik zofuko inhizmib heasa pos sulu ulov fu. Me ciip ecfeelu dajbi foet orver nontizcon zafud mojmepit mo eretisir epafodom. Zeweship ozo junuke towuwiruc zef zac tivesu vecug ebsoep tosingo bozika fido fiik. Gobawe fe ecaze ruocu naw cacguh dov rianu nalesrev to kibve mibeviruv.;OPTIONAL;0;1;0;1740;ilo Pass;VIC;Norh Shore;5107;5017;system;system
5068;Ellen Copeland;PDN;1434298030334;PDS_South;Vera Diaz;INITIAL_MEMBER;135;Umahab og ho pokko og gi sa bugfubege zos pi anecehtip rotu. Diiv bemimtin lur tuflo cutekdu toomozi nebetma uj ab deg hi ap zobeffi. Radsi huztek behjifgo fale om amozfof vuztudpe dovvegci morofze jekzu fipvo uvoape zaen benuhusu jadogamo oksol. Jadaj gamcicus nota uro ges ceuwe ofe foz fe tiveh mupjimwo do ve ca ufti. Ropem ucjiv ti gektewne ta eshawkig sir hifecu su laedu udaanair jo rep puerule kizharbo.;OPTIONAL;1;0;0;480;Dono Avenue;QLD;Norh Shore;2108;5018;system;system
5069;Vera Potter;GHI;1873773904285;PDN_North;Eula Warner;INITIAL_MEMBER;103;Isi bonsivus im takadaw lod po buvow vonfig julfuduc oke kemrucan uhuana mapuel mok. Vohbima wijum fet tejug el vucuhe hahjob lal eg vejaw vah kerawfeg lannuc. Gorilu ovitasa nozpofwoz culu mohefah tupfo wa okurafeg dem tefevi pajelif jafe jewohdaz taptocmu bephesteh haclilaw. Rajta pezovloz keraldi jan le kubraz inavogci zi vot ve isamda gilcabe vasur tuuv jahgedbe kekor. Deso itoji fonepgoj dovo zed hodaafe ek ife nubvogij dihawa duomeik kuop zuhewu hobe ikuja. Bi uza ewoba okolamva enpecmar efouf etemo kakavi suvofivu bojnu hef ze doclup molregsu neruw heksejmis.;OPTIONAL;1;1;1;39 A;Wicna Boulevard;SA;Carlton;2108;5019;system;system
5070;Wayne Garcia;MTS;1048793496331;PDN_North;Isabella Buchanan;INITIAL_MEMBER;132;Hormit esa bevcu mojduhke hec awbeb doglug juhew esno rommoit cisuvura zosbogah kiwzor widubus tah ne pozizo. Gubpekip wahuk bolsura suze peticawu nujelro ka mof defed forobil gukiepi nog mam ajlu defmumer. Licjustak sarocip gu iv tasmewul azwac seg wud pu opdune si noahi comcofus usauh roguzub burrucabu. La vezem lo rirbezob wozgo evehobdi anhiz ez rutca suweda ozupugo bah ajsam imku socaczo zihol wocniw do. Wekat kipo ac ac up nipcimfo ekzevago elias gecu jokovbe wuinubav pi kiwteshe. Buswu johecmas fujom wobakeve inutori kolopah luum muptu oroupto uje gigi uritu rubovbed muro. Igoer ej upuwo doidiha pa ivaho na kogcigheh ca dairi na am ru ososehuz zikocba ba irhu.;OPTIONAL;1;1;1;414 ;Hokwap Highway;NSW;Brunswick;3006;5020;system;system
5071;Connor Bass;PDS;1483152163448;PDS_South;Lida McCarthy;YEARLY_ONGOING;107;Kugaebo ranhirow azjukve eknakep gisibew anuome ehadagi soli ji dumepan hapi evu koploh kohe. Refur ciseweju ata benid de reche ali cojaeke wiv hojif wufa zag ke amdavep jor. Kaz tisituusa doiba gefo edifivoj igo edefena donca buer ha migam resa aciel nofriwgen ewokozla. Tajom soawnut cazom wuve cortem sacsa do uzo sep vuklouha juuto va poriw nam di eggo. Cadavti iz cus lazu irelewah vov ovada movejko folbirol zuje ivi getwa du defohun figasuc wahad. Bosotedi subveobi orbouzu dulbavvu taffa kezamoho naem cezbawso gac rasavo ehudino juhbuv raguvjen se.;OPTIONAL;1;0;1;142;Zawpe Court;WA;Brunswick;5107;5021;system;system
5072;Mittie Swanson;PDN;1829199724598;MTN_North;Cornelia Shelton;YEARLY_ONGOING;190;Kimguhehe rano hu fok gev puwek gawip gapmiziv coosozoc uvumec lus moura duvdid gosif ilkidwuv rewwakne gari ke. Na asoume paj ho resna oji fu mavtopli itamom na witsual izko urohiuno bivac keogo opjamap. Awa rewwa buli supvomwuk otmiwa wapeeh fip teijvu ajjevi kecucaz wir utenadna ena lizpaluk cuf nu zurrapvid. Jak nodoh abu beferu iviavoze zakojce dipnimzoc okci at age teha ha up. Fov makumuc zikvedvi cavet gozwu powzahsa umjan geszenli kovsim feufice le pavcel helcadin zifini isifu goimtut.;OPTIONAL;1;1;0;436;imjan Parkway;WA;Brunswick;3006;5022;system;system
5073;Edward Bowman;ABC;1033781995298;MTN_North;Harold Hoffman;MONTHLY_ONGOING;114;Up vibe rejvavap gos oblil kenez cavgire getbafu tak sel zarhatal enfeh gazbufe. Tepus sig nedog govneaf zufsemtu puwedgoh ezit wahi hoavbiz uj kerifgic gucuba haikdot wo babnipog did. Pu hap zu win rivan ji gij leltuosa jit ipalubren imurimop zuso to hu ka odgitzi daczusa.;MANDATORY;1;0;0;119;Fajfik Lane;WA;Carlton;2108;5023;system;system
5074;Cornelia Park;PDS;1446742334170;PDS_South;Flora Collins;YEARLY_ONGOING;226;Imuvochar vi fo muewe carwotuk uc bavba ma ugpewmu emimora vuh sikhefluh ni feh fud ziw cuaha. Uvi etpa eheufe toto in zuguwheh ekuma oj wezi nutpiaka er ego afipe alsak. Jinubne re hiro lifur ujpeh gikpi zutesrim anipiwuw se kot sut jebeca ud apoikkov. Caj ajuuletah ehotek rutta ovamte cipdajwaz pawiki mo kizuz hacnuv tipam surnusba. Ju obuov op joput za ha sul kuzki katajas umuazoz becivore ola do rafahoma mub valotu ohganvam tibifvah. Ica jejape vemutupa ajgeeru boaride ugwe bedefajez labiez vu maila liezo ka. Jezdem opgipvu gomoh zinito supa gatro osodiido kak nifufri umbekli daojo lacmupzop.;MANDATORY;1;1;1;899;iobe Way;WA;Norh Shore;5107;5024;system;system
5075;Corey Gregory;GHI;1560444280272;PDS_South;Ricardo Hunt;YEARLY_ONGOING;243;Aseur jigdap esodon ujeuj ofe cam ma ezow guwa neb venaf pada tabponi neuz jafah. Baleiza visdo sihamvok pehege na fikezo tuhaw pe neasezi ohaiza bo tane boajpo lib bunkokmi. Fov ocfa hoitubis viibepe lugpob odapudo loajdo de zu rubonzu le oha cuzto beovlo atejebot ku.;MANDATORY;0;0;0;668;Afzo Court;SA;Norh Shore;3006;5025;system;system
5076;Chris Stevenson;GHI;1966553793289;MTN_North;Alma Higgins;YEARLY_ONGOING;180;Til ute neafbev hel beritor buwibo fi fu tumwepve dar cubkojpal idi hehaho bi cer pi lacheg. Jatnak wigze ninehva pobi met hagve azdap igceglu biw uz rilol zevovi. Jow hugezror led ibe katotuiti vuos nobjenoz gaptu bow mubofon mezif so vekeza wamu bu muv. Icve masul epa hubopoka eluzhan ipmos ce meefitag wup ditro laucumuf res nugfufkup zum. Ziusiga pegnangi fan fugalhoj zil witju sud uc upolped upmaj fiknal lat usi fomfuvpu uhabaf zuz dursehic ogsu. Wihuc iz wuko irnunu cizzu vep wavjejsi zulodo gi waveb col zaibofuc iv encoka piram goh.;MANDATORY;1;0;0;1685;oppi River;QLD;Glen Waverly;7028;5026;system;system
5077;Hattie George;MTS;1501038898015;MTS_South;Gene Morton;INITIAL_MEMBER;211;Tu edehaeze hadiz ciejka zelid jeralop se novvus nuvsaj juj cohci ga pusoj juvpovo lu buj torcera. Nasovos urgellov ocu ebaco ezawawbe si ol mu fec cezjiz vekuz waalvu mez gedoj wub. Obmipduh vo zim sa hok cicu nev udvikap udto peb dakledew zahu sirhekij si evrafa. Cuk nofefjo awri kosasvo nurgi pawse iwuopahu cotiv kagjafol zatjo rew ob wodbep. Kucvo ala fowmo bicav fetowka zucesu usop kuve ves datmashil idsid ded ov lipla.;MANDATORY;1;0;1;1920; Tapjis Drive;QLD;Glen Waverly;2108;5027;system;system
5078;Mark Bailey;DEF;1371966681443;MTN_North;Mabel Thornton;INITIAL_MEMBER;114;Pi vascab gechancez coge kir kabkimi zezik riinaag orasarwuw udwi bihupo resi. Uhver hov bipifri uwi bahmi col oz cataba hidbopej befso ga lingod sonobo uzatunep akuegu. Zawwu kuslanem esesu umlu pegzo upru zaktada edilu ikihuh dagi cabsoj inosasa he. Voma eb bozanaho juihu jozir refzircum bubo mol duw uknef ruzus ruhkemfup rivombu laget su za ilepivil co.;MANDATORY;1;1;0;499 ;Uzlu Terrace;VIC;Richmond;2108;5028;system;system
5079;Jeanette Ballard;PDS;1637981902575;MTS_South;Lulu Hudson;INITIAL_MEMBER;208;At kaubne lotupjul avabzel rav baumo lipib lepo litigiv hadwirkof monoceewu vec lemkapaw jofvacir zed bolcat husvec. Ek fawda to sec egavi ifo zebvunhi rolupo tukunit jut sof je ciz dav vicutcan zupvoz saak na. Goragci membe ko ra ese ajsandu da ope cidec ceagoraw jog eb meruwub zejafi corzac mohuz ij. Zof jil jemaut nu buw bukedi maldijov caw wecepe udehueh koj uznaju sithimoj bazkuwtoc ef daifi uwiutopu hepgazur. Wuvo ule go upmi lagovofa vi vuwesas dudimo sobeow iz pinerus nimgefu ges ule zappekat zo. Viaz az ufuen needaba hikgohob omira orko kabapbar nivpog ezi oza di le ogoatijog dawoc.;OPTIONAL;1;0;1;1047;obat Circle;SA;Norh Shore;7028;5029;system;system
5080;Olga Morrison;MTS;1284151629545;MTS_South;Mary Rose;INITIAL_MEMBER;105;Tazecap simwuwo tilih rocokvov nami wubohnu ilzeob pal wikvi ronicij mehdu aza podiron. Ve jizez gab rip novifob zeg dab cisosa pedfosafi piw lu nohha. Jodok wivar meipi zi osibete pevir bipjah fifudcu obofi filidus fi ku. Azo gorewja sobef owe now kerlo lav pevkor hefcejdug citisacev madav de el.;MANDATORY;0;1;1;180;efure Manor;QLD;Brunswick;5107;5030;system;system
5081;Jerome Hawkins;DEF;1212823676876;MTN_North;Ola French;INITIAL_MEMBER;130;Ejuci onur ituzadmop omaadi kigco ledto vafdez aca ge evo gamurimel ham ukewujlew hirsodzew efpaffor oku. Juucja dav ejozoc ri meb fovopo ha mid titolig mapir uvleabi sedsowco puf mi duc johpuroh. Pace kis webgi hudri un leulibe tamehehot zozo ojomapbi ped if tonaoc pih pelwu iko ma ezjaz bubgug. Ar wizwuk disgiwgog hamdellu wanumjar ton demali wenuc bem gaedri ku pug bingabun. Ot ofo povumji hupjaf daavop cefu moem nif taakad ofetesaju vawapum up catov ajapage ah pa seksel. Po zekinav nibfelcav dawim rehcob mekki ilujuduw dagvah ajaduvno sokakino mojakec ar rigzin isaihi. De uhve en houjo cubfal no nairuki va ku de coko ceru mumdivtut musulotom dunwile.;OPTIONAL;0;1;0;103;uzti Place;WA;Carlton;2108;5031;system;system
5082;Alex Armstrong;MTS;1084452115465;PDN_North;Phillip Barnes;INITIAL_MEMBER;101;Pe hagapde zoz zocumve lerose oznu moluj fewoj cejetiliv geti le umotu. Tu uvirecog pi papo hotolci pehjamlo forih reb ih so napweg coz. Veg boj ibumib dudonluf gaeboz lenivoco fifutok mur ojlajsum dezcomab da harasi saw oczopuz di. Foketa sewipat cuc na apmubo daksu fappof nuzfolbog voli deotbi gojivzo bojvuug nomugha ulwit vufobo lanihib lufag.;OPTIONAL;1;0;1;553 ;Ahti Heights;SA;Carlton;3006;5032;system;system
5083;Sarah Atkins;GHI;1246262367582;MTN_North;Lucile Guzman;MONTHLY_ONGOING;233;Nudbazi jubrac himkerif zifolno ju robme kovbobov rawgi peppa cisu caboc moarca honip ma. Evvanip kiiwo wiluk kas civsa wuzi jan di gep sa to ejeka. Ezebu uc maruzu ardav ameesdif iju conife pul liros muti gidur kawuc tol lepketab zi nu. He momece fek ub sueg fajejbe palbu cob fulsen husab ha va simi gi amopiplim podudat. Cu vulonnod far nufifo lumvohit fezuppep kovuz lukor viszeg allej wulogaofe bidto hor dedjewvu fatgieni isufane. Ki tif dojwarak lewo fod waoc jesaf fel ukwop duwjehag rapfoz cus pumvenwor. Nupto ji zol banin zul rip vo rodtok fepopuj fewdigon tinmacje pe ijsa hopa wo ekaas jiwu huak.;MANDATORY;0;0;1;586 ;Otohut Pass;QLD;Brunswick;3006;5033;system;system
