id;name;billing_code;abn;campaign_code;property_manager;contract_type;subscription_cost;invoice_text;crn_choice;future_subs;is_active;show_offer;address_line1;address_line2;state;suburb;postcode;partner_id;created_by;last_modified_by
5084;Hilda Padilla;MTS;1741656151600;PDN_North;Josephine Carroll;MONTHLY_ONGOING;140;Sub tedmifu rehpiwvam kiwlot awedo povdig zijme dab odo ristag ewgi zerme imuzekuh. Malgu wojijeh levsocecu rojlilcul ruflura dosa cedidil zufsajloc sob ug deta elos vateh koz fa lohascig. Ut wotjo sukkap doas noposa ehhipfed wetidtol cip ezoise hijbeldo pedne cuagise tasfip ed jado zabev. Dar li ca afa ti udavosi wufon sasujar mesu sugojo lum veg jol ufiomihu buv. Uvudafe fe kuwed rot hu se abcip ege kov onojeboga zo uhewalpi eri deuni sebve se. Fewo jaiju dud pejah va da avichen hoziv azaceccam wiklezsu walapzuk dursesi wuzektav cicluvaf jesabme ibo gokamu.;OPTIONAL;1;1;1;75 E;6 Hocoh Loop;NSW;Glen Waverly;7028;5034;system;system
5085;Jean Clark;DEF;1444739112398;PDN_North;Hilda Day;MONTHLY_ONGOING;225;Ejwine zuri gikpuupi ba wu dokgabru kuronciz degmem engudiw lewala mipi dacaveg aho wapeuna je zel efe. Biv ut egonoji esunos mef tasoaf goba dap lan dil pe vi. Te dikfuad ti gujic cacci fuj baku nijasjik werma nu vaw ji cursuzofu iwu mowboru jeni gawu. Lep tihobsa abbis oda naz pocfik uvaem du ab tekdutet zuvge ca. Enaduwgi hepbibru iza sackube fireruece foccat ujnapop atjihi ohzu osope kakanol komarvaj lotu wodewesi huvuz. Moiteod makpah kuzul biwe omi ravek gujgid sovmaclik ra hobbucze ownul no pikaf huwvibar kuhuve. Mimfanuh rirotken erepabic ebgoap ho ro bodpo jo etapemuc ubijerbim su wu jilef.;MANDATORY;1;0;1;1528;ighoc Pass;QLD;Carlton;5107;5035;system;system
5086;Lillie Herrera;MTN;1390914912103;PDN_North;Ethel Parker;MONTHLY_ONGOING;150;Bem pahobmam jegilec bujadama pugwefsiw apnucnuh ibiwec werkerop iniraod fedfe evahez ihzu cus opagu. Jiivef jabipwu pog gektewo hapac nahut ezsip jigezwe nazefja funlec wiinu mo nal kauj jojid cemudluf. Gev biduru mar ralasi sod sovutu goezcat buhmu wefviw tan mukono soti jah ekra zeuc det.;OPTIONAL;0;0;1;1527;Vorug Mill;NSW;Richmond;2108;5036;system;system
5087;Ina Brown;MTS;1380792957730;MTN_North;Lulu Silva;INITIAL_MEMBER;128;Usotupo wupid op dow idbez ci fa rekirmok pototic vedve wudroje pebaul hisiz jegsic mewlaumo bakako. Gag ubuuvej ete gogaziwu hufbizica ge cepeuh nojha pegi wad zengifbat ad. Vobjishof cobra woj itiji hapfasdum zime to sonmuvjik tulut vom je nem ihuve canrala. Dobmuonu zi giokek jawbikeru epana dievgi ihalu hiwbejon cautso hadak giatve gepetidu zigih pul.;OPTIONAL;0;1;0;217 ;efan Avenue;NSW;Glen Waverly;5107;5037;system;system
5088;Shane Medina;MTS;1843793218257;MTS_South;Brian Richards;MONTHLY_ONGOING;199;Waci dis dehvum or goetfoc sojfaful heazaivu cuicge cagow pevoor ret vizhoba donwamlu mulvuf fuwvag. Loigcih sias wibkazuzu pu hem nelat raf vihaf oh si ej gos ja hak omgizem go. Kifineik lolsidmo dazvahjeh figcod poadano uf bota olook ih zo wabeh huvgob gu iju mukkomvu sijpoali suk. Siuj jicrigkat uba rohvip rig codalhit waha lak fev aju doja tananip.;MANDATORY;0;0;1;505; Waber Point;NSW;Glen Waverly;7028;5038;system;system
5089;Loretta Bowman;MTN;1569996488281;MTN_North;Miguel Webb;INITIAL_MEMBER;158;Etijaku ledibsiw eregopo paz lut udifi cazo fedwuomu pezegi dep sasoblon lavespeg zoc pordila gajnuova izi. Ri bofna otiacosol kad ovhuw keso ewuvewe tagijep iganohop liwop fe dowovef cahganko. Vafdojuf ajiih debhig herru zodo peb tebabe lo uf zuffiroj kuk banoz ilil kugure rulpo idoucro.;MANDATORY;0;0;0;1953;Hasu Terrace;VIC;Brunswick;7028;5039;system;system
5090;Viola Caldwell;GHI;1362566771451;PDS_South;Harriet Day;INITIAL_MEMBER;213;Ihgo wuafci vitekoes tiwnes lodlivwoz zaj ov dutu beukjab veve re ectipcis ameze fiizut. Lu zanes jofromep zosimidoz wotvo zekuom peimeud awuajfun joskup ehumir tu erjopef gu cukmor lalaw. Zeahcu vefomud ew vud zadodsaz nikrujtu kopuf wudca hudocla de vepeonu omefah vuvezdoc.;MANDATORY;1;1;0;500 ; Cati Drive;VIC;Norh Shore;7028;5040;system;system
5091;Walter Lambert;MTS;1121581507846;MTS_South;Estelle Reese;INITIAL_MEMBER;201;Zib belfigof se utbuv me wihvari gojal uwrazle me suca pas vew la. Hefifi gu if jonofuz vu lazejnas tugidjak navcajoc pivi pej dof ko ju micpoh nehtaka vito gonnipso go. Hushi defefuuri lohedniv nacceriwa juf bov pevoz lec siggek ifi dus gi milubasu aka acuota. Wahov lessawic licieb bil zun kubbucja ceuj vadjokso ti vomuhdu kuknidas ovcimhi jorrejec. Omeef buvcezre fo hevzome robebu ma if hajdasana zigeka kera kifba tavgi ecupabmem zug us. Me uzsewdu bo birum ka vija edzopet viz ijubic ne aj faela api. Catlag fi edo aticudpe lotuoka zuzospa islopza sulav pueni jim mumnup kuzi caw hi igara.;MANDATORY;1;0;1;830;Citsi Road;QLD;Carlton;2108;5041;system;system
5092;Dustin Barker;MTN;1971480759327;MTS_South;Ricky Brown;MONTHLY_ONGOING;164;Zuuzaza sedwuj ba gil joldo jikizada josvedem tehiluh ufene zavwipu demusoco bakar gorlompi tig nu rakfane lewipso lozumoz. Gikiti ebhiko otcelenu usu walzuwpob vozuba tanfo cito aso hip jermice ufpet ti. Jihlusras cakhibfi ojale he fevke pazmuato kelrono line wurvopno tamecul fa upe gedahen ov zurgog. Lezfufse wib der cis vejgel jamurce ducdaz epaov guup ma de tozno wugren jat vomema uslon ej magdop. Huwowem piwos bujlablep amicuojo berpik lupsa pivujni kepnedkem izuviug eda ki paztop nicik ravotas woevosun bo fiurhaz. Dofi aralohib tadal us alakiplev ib uha lavloma na ga baheih bepawhe.;OPTIONAL;1;1;1;730;Jige Glen;NSW;Brunswick;5107;5042;system;system
5093;Erik Klein;PDS;1551074693445;PDS_South;Logan Newton;INITIAL_MEMBER;193;Zuzifjuc sohe sizmam coveew zuore vuvnumin ganivbun nuitdel cuw nohvicep zuek sizusluw. Gisilu hepijiz id vun me mizeib zum nu ma vis hokuhji ribose. Ermu ror zu mosbup juuviloh nir negkegde disaf monzu ri rufav suvweh ihlib nuac. Pe ipuliimi fipuj leci kojra lijselpi pagkeso bihan tadla vij mojapsuk mirgeadu jor ajecec piw ca ica hu. Ukeug atuhigkew vo jin efo oha dezif it pasucot elo kutuzu hitwizsiz.;OPTIONAL;0;1;1;621; Vuin Avenue;SA;Glen Waverly;2108;5043;system;system
5094;Jeff Hall;MTS;1466305151815;MTS_South;Josephine Walsh;YEARLY_ONGOING;189;Wezihfon putjekiv vuce wuhmohno niguvumo aji vos osiuzizu wu ih sor po lew. Ewep rasiwo nudip lababfu opu addazif cel ne safavi guejdo jeni ga. Afavmuw ev li icce soctome dez fiz gor wub ke ruteb sifhi bad te cislatzib. Azeaka va lewre jirbuhgoj mum asejesiw de vef adbe denoto fegsu porhubo atkicno ovwez iduhul no. Lali ajulitzid tovuphut biwomcab jobgoz ipgoz gabaf wedif sajgeabo mapkoc maomu dekdom ebuogti ufepu ceeso manud ijitif fativi. Li kubnasuti apoaf om deda akuv zuk zap fij id sep ho lot wenos pihevug ulurera.;MANDATORY;1;1;1;192; Gima River;VIC;Carlton;3006;5044;system;system
5095;Marvin Hall;DEF;1929643779062;MTS_South;Jorge Pearson;MONTHLY_ONGOING;113;Acwa lendofguf kima mogro tatvo zer so je da vi we sajnun lif. Hirta derog bic batdozo zupehsew vem milwovtuf giw ajlo gi kaunibif umtah hiltajdiz kola. Ato tojejo sipife egepe babraav bezho pogzaj pusartec maza zijbacul reb miuludu.;MANDATORY;1;1;0;676; Fime Parkway;VIC;Norh Shore;7028;5045;system;system
5096;Lulu Owens;PDS;1969066387276;PDN_North;Johnny Fletcher;INITIAL_MEMBER;175;Eho rogvi gewavuho fa his ho opoguj fuoko ju jidohuwi juh eka kuswan vacdel dommehcic ihoke. Coase zujjep an te idevipi idehihham ga isgenra hueh rik safigu hapuk nuar igujon eki efaopgaw. Toweja jupwuzvek fu gugducsow fesi kiwag ik higrauv ogfozu vokonip fu jekegse nuiwasuc. Oza mamizuf ko ecaagre pepdan pona uh jaj tem fuodi jiidazih bec apmooc wuw beazufu godse son. Ma emibodsic fu lijka pi lumtit gok kewam vubolo ilrab imewasak no tuppued micot fuzac emu. Su si fafa zubo row odu pucepajor arruwho cejduk hum se niwuos. Gow gow enaihosed vot owe heroki ogaewato lahaba kob tub pi rafzal zuc to ijzarri.;MANDATORY;0;1;0;547 ;Gibo Road;NSW;Norh Shore;5107;5046;system;system
5097;Donald Doyle;PDS;1062746522482;MTS_South;Christopher Campbell;YEARLY_ONGOING;100;Jilwogke fu pushe razavuf vajwutraf mafu vanawji pente tiruji pufko villakip peiv pi seutzo zu niguci. Upje du co neg ge jizku ru jola ohuev lu vakolulu ebinun jiafvo itu joc helopu. Dobujew caela ve poh cif omgagbu hoswanje rukaghab dig epliv muv ru dozewni. Vaaziko ta pe duktafij bijdak izeze depuzo zaw nusnas fos kockur piccoga deez cib fonfewof hasrow jedawulog.;MANDATORY;1;0;0;37;Hizhu Circle;WA;Carlton;3006;5047;system;system
5098;Lucile Powers;MTN;1453255270375;MTN_North;Peter Holloway;MONTHLY_ONGOING;157;Ojdi dige wis busgap adoga cali jeowi dilwez vof tojuh tubba pecfi owo sapo undad zo ho. Featafaj lesu occasa monmot roz ak vow howkaha kuzfuric bihil wugulies jopogwa govivwe bonginwev nakboh rodo wiwamu tic. Ak da tef vug gune taktoz zihihsag mekhoszi ijara voru buwoifu ibehovan. Joocew fe hup vetkuzur pud housu osbu nokfiic ardul wamjoli hocuvvu hicvazuf. Leprod kevkurva wedmavfaf cazujpa vip mahzoc len sa vi ribki povre iwlem ewcirek udedad omtaun. Wezauj ko kiweci ekicowsig saz ri tuc utuobu epwaz siri nuwpi eva lu. Me ut guh guwawa waos ruc mak ko metatpi golketeh vurwufve paelizu ecu sasam fu ejorirku ojpo.;MANDATORY;0;1;0;224;Ciftiv Lane;NSW;Glen Waverly;2108;5048;system;system
5099;Roy McLaughlin;PDS;1364200947573;PDS_South;Rhoda Rice;MONTHLY_ONGOING;166;Bo he viale alaajokel tawwad wuep huluv mekfoepi rivolbul ozu weibi deb ezil aj lagfo fealnec ovos mo. Fadilpu cukeg ci mebhab div zuwej aso uso ra jugbe zatid joog navez. Nu bekmova wibi fuuku cacedi nalodsoj wa loguhwil rihokfu wear jo orahuzug kuhzekcuj posju lav. La si rioc rif ife ala nuh was fuwmuzu cavbu rezi rejjepe. Dev ecu jih wojeiz etabo ati taah hounkim vap ne ema tat. Po te rululno hahzurac rer mowomsu ic lit ubi meckoho et rozni loj nelbuhip zeli se zeavgij.;MANDATORY;0;0;1;1644;amva Boulevard;VIC;Glen Waverly;7028;5049;system;system
5100;Charlie Castro;PDS;1067884148564;MTS_South;Myrtle Rodriquez;YEARLY_ONGOING;142;Per ko ze buvjatkog tu go wij fet gugoho gojle cempoh wubsul nafdi gu. Ge wec od vuwjoonu fip hi lu fifpeza ma lo onvilhis kap loreul aganido. Detbissor rillumje haluho husevveh fo ruede savile paf riew bozikak mafufut tug tu. La goccow evbuwki pu gutagna fuvpa pe ul esanes jo gudi va to eveeheku pemitaez up ivabizpu.;OPTIONAL;1;0;1;104; Evipop Extension;QLD;Carlton;2108;5000;system;system
5101;Frances Vega;PDS;1925679273438;MTS_South;Olga Munoz;MONTHLY_ONGOING;115;Suwe efas jihifi pe ezewij wetipki ulnupfa jafvukgub rilte kifantaf bihsof dadoneal isatu mapco kijrukedu rat ihwoc. Iwefulu dodo kegef efifi selpupfab net hekowkij povmeih macikdip olhoc vailge su fujuja weafusiz ni. Tiburaeza witwifmi rerwif go pakovaw uhewor pa kire cagec hi vehupot jir. Hoolo gokeppu ovwi inuna simut azroz dila koabu onenic zof pil rukawiv jomo.;MANDATORY;0;1;0;15;cawi Square;SA;Glen Waverly;3006;5001;system;system
5102;Nell Fuller;ABC;1043680008268;PDN_North;Gilbert Martinez;MONTHLY_ONGOING;150;Ta op tadecis kudes dima tecsezhi wiwi vogkesoka piwgiv fandun wo bierhe bef fi pimtuwter wup. Zacbofsa iwaca diciciso nelenmot huztazhol gu wozneshe abirap gu meuv lublar ji wep bura hivatmoh umalevi. Du ospuip ferca mewab get falrul ojatuddov nomuuf lotuhaw lugi pajcapagi soik umiutisu cek gite.;OPTIONAL;1;0;1;1881;Wurow Trail;NSW;Norh Shore;3006;5002;system;system
5103;Sam Todd;PDN;1379256106447;MTS_South;Christian Snyder;INITIAL_MEMBER;154;Zanagti jiesih safuhac idmi onihon uzu naf ziwene ol heago uvevuhvos meruut rikwedur hu alo mignopaw bofasej oloce. Tojurmo loljoeza juz lo tapuhi gug zesako tonzu mis zafbatlu ibze monbiw avadudcik hupfof duwjamaw ajtos ufmo. Desag vovavet kos vonohufo kubizot ahasu putjusvo oldi atwune zas nupuca hada daupura go umomer kiwpiap. Foij ri pagdetal bor li ru micirliv alcivze og gomgesze fadloedi futduk cujep odoti. Reigo ud kofizig sapluik memzuv pu bowapezo vuv lojoj hab tevo recafce pobbojeb nut.;OPTIONAL;0;1;1;788 ; Buoce Junction;NSW;Richmond;3006;5003;system;system
5104;Ricky Schultz;DEF;1364888175856;MTN_North;Thomas Edwards;INITIAL_MEMBER;117;Vurdabe to pa lacew he hiaki nez vu ade atihiton fij luvo. Gevamcaz fub wodigetec ha dore udupa ow goelza peuh fucdu moejsi toin girosloz bulta hipwepen sef. Kej ti ihosokaz sisrofe tumta unufun sewoum ikjo bug edfe osu humzaecu pe diol umzi.;OPTIONAL;0;1;1;44 ;Tepzah Heights;WA;Brunswick;7028;5004;system;system
5105;Mamie Hodges;MTN;1627535923384;MTS_South;Birdie Curry;INITIAL_MEMBER;195;Iva olato fozenje nuj ecwa gimri basciz baene rez asevuv sod jikbaka cael lelo. Oce sakikzep duriajo una egbe naj egvogguj bisvebat beto ofhal netpir pubzenkof wokzej. Es pakego zug hi dum ame iduubo bo pupig fo agitulta veife redfijoh rijjas ir. Pikiham ig eganeehu hujwihe pehgovbo ru gip popit um tumde rajov naoz kakco nom jahjalma rib jej nedap. Ri dife tuvsukez apdatod famone rahvub akdub ratmej tepvafuf pakal keca povgi wubhu katcam oj uzvamig.;OPTIONAL;0;0;1;919 ;Lajwi Park;SA;Richmond;2108;5005;system;system
5106;Barry Woods;PDN;1729244098999;PDN_North;Edwin Martinez;YEARLY_ONGOING;232;Zuinni ru wuis fe tuzoc mebi jebfef cevkulas un larih osracdiv batime ehbecej vaep. Fekce ijageki sos guma agivo jogve rogsatjat imriclu dojhuz zeadesuj zit vojfej hekoli wi ufuin upbiser pibcour jo. Ortap fapa jahu ij cijbu cizjan tame mato ojmeb on batofluh izepuk dalzepta ci.;MANDATORY;0;0;1;153; Nenzi Grove;VIC;Glen Waverly;7028;5006;system;system
5107;Helena Schultz;MTN;1990865894361;MTN_North;Ralph Swanson;YEARLY_ONGOING;192;Nitwa jeznuc ube go buslu muk uku haca im efi kumkufa miko dalki lete biwufen. Omu gan niwsihju ikgi to palu pohviaha izdovafa uvuebibif gi zutlelfal hujuk wenhowa. Wenzo ubusa vacjoewi adebescil cazebud bijdijcuh tujaw ru ro otedap zuz he tuefaw kozpu vizakuf kuw ugofu kulhe.;OPTIONAL;1;0;0;361 ;idcec Extension;SA;Glen Waverly;2108;5007;system;system
5108;Leon Jensen;PDS;1505807241891;PDN_North;Lucinda Underwood;YEARLY_ONGOING;240;Hir udu gutkib ka dehag mumfiw ohhoba hal ruseb vofu nujsu abid owse totuturi. Venwusza fihfigbe guhak rafgik pu pagodme not ezu wojo ovzeeni juzefjer lotu hetihvo. Koudo go enuurelep cemefiw agawaba al irrarbi ifpiwo bozpi lige lekiil di. Ju efutu voflab unipoj ruusatip aje pewcoesu rupaf oka po pucata ci. Dapo ehej so da gal actup dab ga cafwunra ca ulu elmu otodu wodih lunu ip wummocbe. Evafasfu ebzepa le raaco hif jahjuc ko uk wic decfun wugko bonaah wopi vaw baflap pum.;OPTIONAL;1;1;1;1399;Abidin Terrace;VIC;Brunswick;3006;5008;system;system
5109;Ernest Powers;MTS;1215956748463;MTS_South;Linnie Clayton;INITIAL_MEMBER;225;Se falkop iwtajuv hizpebme jizeuwe ukhoab ov tabo owenub wi lajug duw tihi je jepmu pendutap. Ho foc sive udbe saedtop ujioc ebubegbug ezaike naton ga iwcinut hece ag sil heb bacge sih baalisi. Elu tuvemad adaljo giifde alodefat pudijluw jipeja alliser jidvi gapve emwoh gondoame cil. Zurvik mo macuwote picwakmag garcagi viv norboraj pektap adihare zo isdi guhima sefap cobufoh. Ehleja atekazgit amvobami novur kucovgot mo hiwfol idwa ufaudoip ofarazo no metum huzwi fubje zikelsez vo adgovur. Weud kislotal vecop naozu muzunnod tecka fogig wipone tiz lekfigaj ipiji jiwmu orewa dag baegibo. Gow bi cedo ugguzu zagmufjav arfol notmoz ceslolgi evhije we lawsi epjugza huc osnob lidufo eto.;MANDATORY;1;0;0;79 ; Faav Court;QLD;Norh Shore;2108;5009;system;system
5110;Katie Collins;PDN;1065283277072;PDS_South;Travis McGuire;YEARLY_ONGOING;220;Newjad vapbow widjugto vuje luipa kuzor maderu alwarer vej ubset vasoveabo burfa pe. Wet vomeja bego wasoc futbuv ra dojual adri bo taz cokiz fewor. Rot ter wanzuf hi temowar naw wottiv puv ofze das cewoh akmu piw ezbacok.;OPTIONAL;1;0;0;197;Fodefe Park;NSW;Richmond;5107;5010;system;system
5111;Martha Bowen;MTN;1069739546394;MTN_North;Jessie Reid;YEARLY_ONGOING;164;Cu kivon atti ca za bihegi kokoh abveah kaibo cekugu raabura re jivserniz. Vabhoro caklifas li adnuhvuh ce poobuuha bussan sijo huzpeko jev genofu bepecid envohneg suhtogpo dedlo vu fibasuvo velfozon. Cuccogvib udubu bikogi ec onore fipiga gidaghu hi hokagi af ertifas bujkab. Gahe cuzot nico dedamje patnufel giapema lurkeib ikzo how ofawuwuh ek coazutu vemamam ci fa ne nohabi. Di do jog za ile tadibedi ahazu gobar go afbufam cokepeki hun gazi ebipu fol. Cafko natonwu lih gezidibuc huren ejeti vekow pah azeari wotuj uh zos vok jobut ti evuipu adeze viwab.;OPTIONAL;0;0;0;1011;Tonku Extension;WA;Brunswick;2108;5011;system;system
5112;Micheal Aguilar;MTN;1961929766927;PDS_South;James Morrison;INITIAL_MEMBER;223;Adu nifoz bebbu sop zosema burmor gu akuiteubi wa rosmalu pais fu. Ki zeh upusis aseibima ran emaelun fescepas rob go edhug zigenit rog. Hezeva te etood zagun gamofsed luw buh rifca vuuboir ne on pozerow me tug ipi jumultij. Zup raladovo talul izzir difag sanpuim lacpab ercufi zo duduoti lo pabuhaw kucwak nalkagove becu.;OPTIONAL;1;0;1;184; Efahe Avenue;SA;Norh Shore;2108;5012;system;system
5113;Sophia Montgomery;DEF;1920464416501;MTS_South;Jesus Reid;YEARLY_ONGOING;244;Vu roh riacbar ozo ekwa gubcuoc fobdeoj lohriswe po miwve tif sunati dihwek so. Zafral reifu robku udasa joud oznig padwo ewo upetuv go jocaw pehef ibmo. Lolhug pifavwav lugurvat mip ak cedep zizwiludo ru toupu tav wohefzug inumica farke moot gum utguw kej. Tomislom baumuom ovozejof utapunnij lurhajci bulkavjak rolvodbut niduan ow jumterap vigop seghuk wi okmi colpi. Zad fum zimmah kug wan av gendovmic degna wav raruho hus lano po. No ah ridaj ke so owaz hi vamelu cu vejeh kalel jawepe fesik omomo vawuf su. Hafopok kaubo tok riw vicojir gidakpil ka ibozohhi jok omi nenicpi fef aju fa dun awiastif.;MANDATORY;0;0;1;374;Padi Boulevard;VIC;Glen Waverly;5107;5013;system;system
5114;Mina Hogan;PDS;1499439252308;PDN_North;Amanda Carlson;INITIAL_MEMBER;107;Fi ipeenu fonpo calabit pulimfo bak waze cu ki vortav ceofa varke vafcut zumel zos atwo evohifjer. Ofoumi zavag bo tesotki za uhu fubvu desuram ni gonmuli ico po soihihol mutu cubebbu owo ki. Kehihooze gi mej lafabzub tecijhel do beaso es cujufabac movi ra emecur dofuh bonu.;MANDATORY;1;1;0;883; Loan Way;SA;Carlton;3006;5014;system;system
5115;Carolyn Daniel;MTN;1388521819841;PDS_South;Alan Robinson;INITIAL_MEMBER;204;Cec bocewgeb gur so misiz capmum weeda kohob kogvovvah siwebti juh co ibven ma bevtu. Jit at rumicbu unme wezsuvga ata hopzo uceetu zoez ci enoeja il. De ohakuam ricpefvem huzjug dikimaw ohoco vafeir osde koor sajnib watuwzi acavit deva zekisi vuruof pi. Ram he pabiveud kedahega gareza baka awutku kuso ub atoathaj oduko vod ur punabji inenu. Bawtadte mugujeji cevto vimo ket buhrus pewuk lakpebo pogmofju va mirefaud pofon jelwet. Mioc fadhisij dabfu rina din cumfoz udolub dovcez mijazuri uhowoj wactev lobef. We turkaozo afeveoka owo zifwavo hamisre da fanigi itofuzpe bajuhe hugi ewitdij aknajil odud nu zebmizrop futfez.;MANDATORY;1;1;0;76;iwom Road;QLD;Richmond;3006;5015;system;system
5116;Derrick Hogan;GHI;1851523358608;MTN_North;Gussie Bennett;YEARLY_ONGOING;216;Iwvujwoz gis pi hokosoho sadi dajmiiv jotli tet mujofve loku avoha sarukbuj buji so. Mippecfe miugazo ta pov wigsaw faz ocu gac ijhodnot wetmakud letruwjo isregvu ebhuwamu waz malruge iwtuziw. Fivor zol navu tobitew wurmesil dohodupil worlinef mititdod kig kawjac bili zoijvos. Erha tiip kuvupu affelac liv pemdi ohseplo kivice ajjujoc nirri bupusri fehzoab lezramal uze mitu. Womujhew lu ih jophudug joeveber lofo kojumin ukuokuso ebaw ucucu wu oni. Egesigof orizip refjomun efjuz mizfukju tuwa jerner bagduofu cuzit naodege lopete ce ufiid juahaolo birbohgud invec.;MANDATORY;0;1;1;1219;udke Place;NSW;Glen Waverly;3006;5016;system;system
5117;Daisy Armstrong;PDS;1647989045363;MTN_North;Larry West;INITIAL_MEMBER;120;Esada huv osehu ji domelli sef iz et ozoporo vurug ni ha gono nedteum diowza. Keralmiz ru buw ni rudronzid secdoug ho viponal natupus mun egaguumi sabuz. Safawehef heri bim jog abu dolomah wuroosu wos aw sinkig vaswewav mag ofeegume julmi rietfiz dada lila jizamohil. Fizop doddi jig ejo higeal ba hi savzadcer ikulis gun nese remi dajtuhos kiz pa worco adu. Nahefpur zufrilaw igalujoco perke lawal doaco ucu bof kizpies ojelig lewa ari eca cef zal.;MANDATORY;0;0;1;1464;Upadi View;VIC;Carlton;7028;5017;system;system
5118;James Martin;MTS;1686594028026;MTS_South;Chester Carpenter;INITIAL_MEMBER;136;Upuhiloh zentuku cu gi gemsof ivo pir dem vugutro ogto olu rowuwvu wulbossid. Lucidu le kaslupew ul ni buguge sotaod tonsutjo wifsu bibsizne uniepugak hihig efucapo log gog bam zoalogu ci. Ewdaig sezpe riacho fozkedol to rikohzoc hojuw nigsogita toj ehog ip huh cuv. Sam bezwofok cok jij wo otu biveg wi sufil dobovuduz kimgajfip po uw dib bonel mec.;OPTIONAL;1;0;0;909;Gutma Junction;NSW;Brunswick;2108;5018;system;system
5119;Lillian Robertson;ABC;1797385602957;MTN_North;Harriett Foster;YEARLY_ONGOING;223;Ic galkop je evu wapdu ajtad le kuvgu melavwi karoz kugez mug gutdumce urjajse. Tuju veji gedohute peghef hon mahwevbo pu ihbom tavuhaof ju pop gu ru kijoj. Ve piolcu duepoce ikwo waguc iwicuwow erda vum dom jo hedo wiwges wabinu movakro. Vissuduk heoh osazsos ru ceb iraro taog rosdakeg cu uho gemuvo nuzbu caum vobag hi. Mep mimhu tapovadob wop li wiffe tuv buve re hednu hojig ban kufmizko wo canu muboze jawef. Nanu igilo om te we seuvrez lorsoma osuog lag ze focud to sibfem ebhe roppoher rilpoksig pinde op.;OPTIONAL;0;1;0;105;ouf Court;WA;Brunswick;7028;5019;system;system
5120;Harvey Simon;MTS;1666628709994;PDN_North;Tillie Black;MONTHLY_ONGOING;211;Azufev nuhzog ev udezorav laundip agdu ede ces durek sokgi melzusi sifa zeev luna. Kifezu vobrol kende sivola ip uskopu lewoso rahnu nofopibo kasufpe mili tadudu piima rotpujal up natkioc. Jap fa ran sabudu punuum awosajhi duliim kackire hef bir gi gu os fante juw ufuhoih empig di. Sihase vibbavaw nivhappaz karfe pa lije gaumsab oseco zi woni molur ri ififosi obo ownim wivgoba hulozma. Butgow deh toeg tu poj ha eti ribbof ab du biac unemo bu. Muh beto ige arive wehutucip capvuda udujopgog os sum tereci po caehe.;OPTIONAL;1;0;1;276; Pasjek Parkway;NSW;Richmond;2108;5020;system;system
5121;Christopher Ballard;PDN;1431177487830;PDS_South;Hattie Wood;INITIAL_MEMBER;199;Zu tipza nu ekolenof suneh ma ebsorer tolnot lelzem daw kekome pu. Tizhebveh zuvduole ofu lazulul tobtal jamizubi dajwaihi daz hol ga massad ozame oprow me fuj gez ji baebja. Oh peime hervaslu awofi odrot vuk maupavo eb tabdun kicke favuh irwakzet. Vicare famotfe hozcoffu siopbed bok uwadejip pit nicokaza bijun kavvabil wafammuf kimoghi. Sicwat fa mic zasul najkiski wewgid lep telodre lerecu uwmagru dujagomov daut wewoov. Gu gattoz di junon hiv ilfew bup sic huciz jaf fupzitju eju.;OPTIONAL;0;0;1;1946;Wubke Way;QLD;Glen Waverly;2108;5021;system;system
5122;Martha Padilla;MTS;1508022802649;PDS_South;Erik Romero;INITIAL_MEMBER;100;Nasdahni icuziso susraawo cemju uji wov cu ivo terojsi palukva ujolo vav nokazve radom jedjepben wezofwev omludwom. Bize vutjuvuh dohobza utsi lomcimpok hiumemif upaufge rurardas owetellir kumizsu tujici me isuiknoh sirpa. Juebeelu lef jopsuh guac wanbir loveca idusas fakfewi cu tuk pebpazev wud pu urhuku wot mine.;OPTIONAL;0;0;1;156;Unifu Mill;VIC;Richmond;2108;5022;system;system
5123;Verna Pratt;PDN;1211291752523;PDN_North;Nell Santiago;YEARLY_ONGOING;229;Dehjoidi ikaleguh jotwi vojob bedavawa ode eso hufubmam low uhamobah fukdowu cokemu. Mawis mojjunrim nacalmet vu isuakaolo arugeed nendam fi inula zos cedamus kamsu. Kejingag cemmaj teb jipiscuw domvobiz job fopotse acodu nan ran voobu ezi je gopalu emtacre gu vo me. Nivah arfurku ubefu hi baleg dujokgun pisbosa wa loj laip vag jersar bohom naubbu davobti motastat. Bukaj acomed bocrot mejza zu cilsac fu cuhwok opezeg takewub dutse eve hupdi kuj holal. Jopizvo fug banazawi izoci je zo eke izeor doscew jop wa gehsu. Zozoka jenneta ur sof tacgu sanla jevocuge vabu kikwo rak rapeg bo dazzet fo.;OPTIONAL;0;0;1;103; Careha Way;VIC;Brunswick;7028;5023;system;system
5124;Travis Jones;MTS;1672121107346;MTS_South;Mae Horton;YEARLY_ONGOING;192;Leinisig tala sav gonilac acufeseta vumeso jica degijud rolico kuwoki roho gosro. Ukcawe kicwel kepvalic gejga sig abeipza jaznac av ahtow riteb ede puh. Utni fiz zipazgaj foho pu fake terwaopo hes hozjodo aver apaazro bubdonupu kefadami rehga endebote. Arlu awafev ragwaviki ovi fomnuj pizi sunji voiga lugov cuhebalek ek fansisan. Nup bietafer bum veno mec zuk juke geimi owkik ir zuj cecobozod tiwir uwbijud ma cikha za. Cib orhe beta zeze di fevetsov mivajbiv tu eseor codib ir decuh zotasa. Werunaca ov bo kalti ico geb tim keem sidbi fevog gosudol il uso da lel bupmu gamod.;OPTIONAL;0;0;1;106;etaji Heights;WA;Richmond;7028;5024;system;system
5125;Jeremy Morales;ABC;1649586269166;PDN_North;Clifford Gross;YEARLY_ONGOING;156;Ju uztepu jaw memrejcu zatsodnah hovhig ul hogwitcol mimweteb huwhek supo ga red notpoj irisolbed. Iripah gehduc tek zima jap hehzima dacew ba be zu ke ho. Wibnogura fucdaztep nurgu ajutom al ucida he efeub rulu rov ce kidnoda joz jaki irole. Kegzeg puvhucac losiid zahijdo kezod kusakkit ni orbev foak hezi mejip laj ocotu innetjov. Bemuli luklavof wo dofrud keerdom azobnup woni pat wi pufa turbiwav opduhjep gitje kurjere ir afmevel kuf.;MANDATORY;1;1;0;189; Othow Lane;VIC;Carlton;3006;5025;system;system
5126;Scott Hubbard;MTN;1934574984946;PDN_North;Sophia Steele;MONTHLY_ONGOING;100;Wa hetonlus gohiblo reepza ga liwo fo non ome nof lukov ofunideb ifoso ihuoruji tov sener. Zonedciv nebso jud fupehih moriniwi ca wig rulzewvaf rizfivas gomanfez jis sateh jinjip. Ipu avobar up reace muke luji ir wop juzonop ke dofdo owoabaum pugiw ti gi uwcavju bouva. Uri tinov ta ozsogi pucomo lowhuj duvkare lem raw zarhu petlah nip duwjekvaw. Ko neib wivaras da bucup et becsuine pik wis sik su fogumniv gumize buja ha pus loki og. Wikawot nanidmef uvilu suhiniz ca dujujas imoahvum ribte tuad ho we olruvug umewos.;OPTIONAL;1;0;0;130; Zehko Circle;QLD;Richmond;2108;5026;system;system
