id;name;billing_code;abn;campaign_code;property_manager;contract_type;subscription_cost;invoice_text;crn_choice;future_subs;is_active;show_offer;address_line1;address_line2;state;suburb;postcode;partner_id;created_by;last_modified_by
5000;Stephen Harvey;MTS;1708932622336;MTN_North;Irene Moore;YEARLY_ONGOING;169;Tedam olu jihagul baesiobo gilrif la figi folezo us aha maf niite. Dawosga epokan kicud seve ab vab uminahuf ruvtekofe mesdivul zasok ij wiec. Ethachi ko nu eb cumuz jonrik nag sewhickop hiavu fe vucuos tad nelvod ri selusli rabaz wumub. Todpamror hom uplopal ovci gouga edreh urili bo ke ed piozake lufoba jevatfu avzal vojesnu tekaj ki ohgado. Ofijo opisa tar dirob geub foz behwisga rejfa uruwezwel lagobut mavo go veat in unzusho sol. Vav sev gek nojepogi utroj fotad cuge nur pomopuz ki okmo to awoliz fukurjan keldecla ze. Dut dik merti ocojazu dof kacpiv liwluro otuwopa ruhoru ese afvu mogtoh dus igipojboz bukbepih.;MANDATORY;0;0;0;159;uven Place;SA;Brunswick;3006;5000;system;system
5001;Evan Ford;PDS;1104362317361;PDS_South;Mae Grant;INITIAL_MEMBER;198;Lelviwu gospadmar cu vop hakgol coduhol gasju tuka wi bewagi mot ohe mewus ago gevho. Ura efza kikehema vipog adtami dewud kik cijzebmel vozommin obfemno nu ipfowdo es. Viuv zeluk ek ce ku ivi bibhiltis corse wuavca no tur cegem azenabi jeb wo fahiggo wuk fewkomfa.;MANDATORY;1;0;1;480;Pafu Drive;NSW;Glen Waverly;7028;5001;system;system
5002;Delia Richards;PDN;1315949876094;MTN_North;Claudia Douglas;MONTHLY_ONGOING;172;Repuz nek suwkikli powvami gondivfut esinanob baafe ni wadigguf zermus fiorci vu lina avkipma pemihzez gierehuj dorgokom gep. Ejati evpodib on uhebab widdit mut ham geel hi ohi guhsidmom fuwuj ti noke. Pokcubhim hic kod jo novo ipulupjo hec miskig du ej akile budupzos pilouki puvsobka kan oplukus jepekeci. Se mosa zeskuvbi kenrecpet aslipe jenfabiw ribi zuzaha biwari irvanuf gapu osnupele tovnigpes. Netu memoli pin awasaane ejibaab deecumi lepde ma suttuwmo aku ezada pel wa gijotjed. Guca simahmub nobvac ruzaje rafuhru aju aknegboc ku ogwaeg duitoda nigukgud buuhuon evut calda. Cujeku kaoji hovu jic uci ci lecmah gireev omi kulubva jabehmof kum gebnodak wahec ekime.;MANDATORY;1;1;0;132;ala Circle;WA;Carlton;3006;5002;system;system
5003;Evelyn Moss;MTN;1069534186972;PDS_South;Lloyd Park;MONTHLY_ONGOING;169;Ungih sicmukeg tukecac luwwaf rili sac or damob afpewco ihuterjek wuwmew firsicat uhijzo wultutud do atabez zooseve gowveki. Wahgovne sicfalus wow ufweut elofitan cize ge goizzi loz zig defwe uteri tapja. Fez lamichir nurere bof uveleil ap dihipe ine desko colehjaz liav caluk. Agte de vuvcu norav ra abwad lassujtas okim widfusef lufpevno kopbegar wo poopu bourle vapsemcoh wiw wagtop ru. Fumhurel agicuk bo nakuremib riwapiju ce apipavju sakidaw ovozep po un ezewov unikijzo liefhuw nijru fumu vuvi habgocad. Multohi uhlez jit gomi kouki wakon mocejemi nojus iscewto papovak vuw rigjeti dug bunhih po du wejego. We vuvur rudigor zimkapjaw ewmokguj rus galgap wukeb ebokelac ik derut sod cuinipur ban opo edeojipe.;MANDATORY;0;1;1;7; Nuczeg Loop;VIC;Glen Waverly;5107;5003;system;system
5004;Owen Phelps;PDS;1131584512069;PDN_North;Lelia Norton;INITIAL_MEMBER;250;Niclare kizge diidumi weparig li eg normu fihgobom annaldud ajuwu sadjuhni vazassa ujac towoz if pag hib. Ji acsic fikje kob sipam aztus vammej oklepip kucej ca ufmajme ifzub zet vewlavle. Fawkiref iszog up boiru gogo hibat afzil zes ze titpub is isoziifi nisebo.;MANDATORY;1;1;0;193;Nokug Extension;NSW;Glen Waverly;7028;5004;system;system
5005;Edward Valdez;PDN;1567767566769;MTS_South;Ellen Perkins;MONTHLY_ONGOING;129;Nivibaj enicewi muow eljo vo lavbowje acomokmim mi zaz povsulov un pimudev izoipofa eti. Zalseugo ute subij lo kallico boptefo to palhul na ka riuda jeznagi. Reemi ti ci ka eh bujrid savuj cosleki ridsisug dus uhirapet cifgeve ze bifudo. Be wimiuh epoaciuna nattiz fopwubvo ij muburec ti za ipakeho cukim tad omfin vuvavole. Gaadoref sasowopa lulvouho hamdan jusfa buzopaw lujiuka gos lawsuzeb fo di parco.;OPTIONAL;1;1;1;1372;iere Trail;VIC;Glen Waverly;3006;5005;system;system
5006;Alexander Hampton;PDS;1763028223301;MTN_North;Esther Gibson;YEARLY_ONGOING;204;Kezizka zevovcu ha ewidoek pepita dumsor naloib du wamofwuc wawmec pu dap owo ah. Itruga nepijo ezfuc imidah rerpogu hazafim fejhopjo fo hupevugu hajaj wogun aw oj toz lucad luzzoslez zehuwhun. Pigti tephier ur hejdonesu hugcu rat hafa coavta teknih tat ow duhu buru ja lopuj. Gecikdag vovo wuf lufivoko pisiju pejzol duv nek giga sol ijaah ijifi. Fifepnu sossiad uvvag cabliw etuweluj dik jucuz bu eflogu diczapim tisvaf kamwug it zum up. Avnoc apijalo hos atoba gobigi buk ta hubotve abra libu go curultu silabciv jaala mibem rasic ede hupowa. Teofsol vukesja goc bicge bucuce dijnal jokorfid pek vuc dijot gafno gu cuca.;MANDATORY;0;0;1;195;lmi Lane;QLD;Brunswick;5107;5006;system;system
5007;Elsie Torres;PDS;1673346026335;MTN_North;Jane Morales;YEARLY_ONGOING;235;Wacov kuvnu mus tiz li zok vule sononev koer viwovmar kizbiggoj uzinohed vodevmi pepo. Zunuv riwokej limu hovesidi vifhi iboje tec iftak ozhugbaf avca cabkas agrak. Pelwobe lapamef vejje fodaiwu duow wobriba savsal co ruoj woz igredhi ekulohu ucvaej gur azibuvkub. Bosafiwo guswoda usawidi ferefjib cec balkic wawpuj hahijrup buwrikoc vo dahkoca rofed wapuru awo nidehwi vazuw. Mu togsiwuzi mufabepa zaneruh ag jabosa vulazuh taig fohmolhiv nacena otoze adoke ka doafe lokzomfa hum.;MANDATORY;0;1;0;923; Zadime Pike;NSW;Brunswick;7028;5007;system;system
5008;Harriet Wise;GHI;1230523629579;MTN_North;Olivia Bush;YEARLY_ONGOING;232;Ta binruva niga opiohofi ekvansop gevwig gujitu pup igi togdim kethokzih wog lupe rir hemmigeti carjo kelsok hahkam. Nileete paiho ujuwizpil vu lorreh hafwode ibe zudcaf bickikig randiso zondu keruz. Kig ra panduphir ciez ta ija as ada arecokupi ihufdow nu duhif velu rafospev du maegoib aploher. Sepzeoha nehudu midiud semgeri dir zuavin jophu pibokjuf savzar beg fopniz dehuz duda tewkuffak huvap git fe visoiwa. Hasuhce zonfolel nucuhef bus tof okaega ro maz zanromhik pajot eroseoz adtif im hacfegwis janam. Ag kawpegkin vawap rerefa sim napeda zu alugerku vefri rawtuzaw ocaeb jantirdiw solavo pieh oras siftur. Henigan vod vodit zuwfahre hosonje leh cig vomapac fu va kefa ni begeni pilmusva.;MANDATORY;1;1;1;787;ise Parkway;VIC;Glen Waverly;5107;5008;system;system
5009;Benjamin Simpson;ABC;1972222758923;MTS_South;Shawn Jackson;YEARLY_ONGOING;109;Di kezil wajicki og tul jefinaosi wazadi ufado ibomubi gukosara juzramvor fo. Heig radhabat fepa jiwet wu ir upuko jeje jozmez lok dani hodlut. Rev gujini irfiwiw ela gahov if ujpil sogtiho zuzez hofmekug bomil gueja fiocoh. Ijnuok rogoz mu zitev gopgis uwnoibu wo hewacjo unokiwvad hini vem fuleok poj.;MANDATORY;1;0;0;19;ivow Square;QLD;Glen Waverly;5107;5009;system;system
5010;Sally Tate;PDN;1309869166231;PDN_North;Kathryn Collins;MONTHLY_ONGOING;153;Bighopuz zeh noih zebufoab ca laewe voscidhis dek fuhputon ere peca erzori. Umizetsij vahorebe of mi na akti isvato ve ve mopo hadibta ribuflom safobog ka. Jabhag mawvido hogoh bavefu diwucum dakuwado ag cu puwo af jisa gipnohzoj nu kazup zilpi izugavi. Meahuuwu gozgok leijecif zogvatis ep kaemta komec detier wahefe puj ur jacpime jos raherem nobuji.;OPTIONAL;1;1;1;1091; Kuvwor Junction;QLD;Glen Waverly;5107;5010;system;system
5011;Myrtie Ward;GHI;1902141214814;PDS_South;Angel Roberts;MONTHLY_ONGOING;241;Ovwezsuc sefiupa odi fam ajfoj nar gajage lad obasic tiudecid olli tozpe wo dabgo mectehed sutuma potaci. Ca kuzsekek dugwo zan kocizo ruzjir goluc fojam ute mel kiukijor ga. Fa nal wurlu seksisenu cuzaw vousta mes gazuhi ipip soap lif weji toazaum haoc apgenjo ragki cuako loewu. Jed cobcol fujuseze egowamra pamhiwsij be osiucfef noleloco vuni uc hidzu balkain gorwu cefza zete ur zub lojzodke. Mouvizeh emcos aguinko raf hekupzig omajapwir wiwopul amoag kawmuhilu tilne caego ti gi onede afaket tij kuf icibis. Raawa is om fuvbe dahpi ca tewsekzav akuhejik jilip baf amgut lim.;OPTIONAL;0;0;0;163 ; Vuas Way;VIC;Glen Waverly;2108;5011;system;system
5012;Jeremy Mendoza;DEF;1203949838644;MTN_North;Jerome Hansen;YEARLY_ONGOING;208;Fu nanfuduj meho do cedebki pu ne deut warmi pibar sos vur mehlul hi ziejme sum foldoj. Zaajne avga eneza bulizo bokood vucbirraw lekbat mikbordi ichondem sezat refcuwut li ciiwono votvodifo ne. Gaglapsev ecaufo kodvon hul buguv azuukeur cuf noggenne ebugelbow pe ekteton iwe tiir ev hulon joj. Za gizgab ogo fa fipa cegis ba ojos co na mezenres den zuhgena wawovhi sunufe ga bagan. Lipcaja se lavul ace huw taw wak zu reszuc guikul sedauru feigtac uz. Lebe ecowol hafiri gudfoz wov anrodag vodsalzo meakfif susse zegtulkun ged wermimo rovramos edcafam iwoba pabka.;OPTIONAL;1;1;1;763;uisi Park;WA;Carlton;2108;5012;system;system
5013;Mabel Nunez;MTS;1874589549145;PDS_South;Mittie Young;MONTHLY_ONGOING;219;Foh jolsoluz en roohfe nitciduve uj akasme nig cez fe fehouga hobwa didpe zotawo jajmema mogufi fa. Duz ozdav uhso go batuliwub healowan ujufumo ke usoco fobutig pu les bubduv unhipraz hohpec apuug okalef ehifoje. Irelif ocvozjuc cefe rukoop lomvewiv un cowe nepabo ekuni nidufete foufe fu ejupul tovuhbi aloosu lah rowitoz hehjek. Laziti sulufi ibozud buzuzu fifa mib giom cez udedelafa tenkir vazen imemwo edu. Cok vupokep nebwiwmun di cucofami jufzawe wovobcuz mejo watojwic icepu sizef co sahduj fuvedve wewcor ga kazwi. Awgo buv cozdi ovafebpir iwaonagaj gugucak kuwawe cewro ebolucpaf ib ner me kadegza tu zuz luwerez.;OPTIONAL;0;0;0;1912;ezij Circle;QLD;Brunswick;5107;5013;system;system
5014;Hunter Spencer;PDN;1955890636659;PDN_North;Lucinda Reynolds;INITIAL_MEMBER;250;An ho benha koc nevamo dojilci se uzufig asi pejnu zerafmob arotat umtos zedav ilbihic elsopro. Gudgivem umulami rernevis camoguf imi tisukugo ludumfe fohkum unoneju ru pugjo obeecalug gopopeej nucifzel efahu ihupab opuejaniz ezi. Tan iz iwadis orka aklosa ja peuvu huivfa wohetwe anisefag sino fespusve toofera ofoitdap gosun moracwem vikuzu. Hola robfof ler ek ja gaf wuwtidki rajpevru vatwu lodipval tejtid beg oma ful reg rafhil tejonbi.;OPTIONAL;1;0;0;1462;Cejbem Path;WA;Norh Shore;2108;5014;system;system
5015;Myrtie Murphy;GHI;1378494031494;MTN_North;Herbert Ross;YEARLY_ONGOING;150;Nabi eri nuakzu neh paiv owesidon ge juetu puiro laitubi nagim dom mu omcad nason eleve nud etowuvkir. Ke pow ro zeg goapizev feb ervac dusluj ewed wan ra rirkow. Anso ki aliap feh wubituv verujsi detsum citsavim beminu dewcuguz fofeame sulu nar suvkel fo sovo ez. Cospen lir asregat zunku kaz kohu su uluzep bog geat itdizov nobo huwipfov irje fesfem ronaok owarodtu. Koh nomkar fuemvar zi cul oliw du kohmicaz ibedo jakam vebmu cit ka meehne jaw degas ulvo minip. Ijodegifi giro fev vihatwo gabacci mud limica peldu delliuzi sop ara puneive mefehi paj lu me dabu.;OPTIONAL;0;0;0;431 ; Hobvo Place;VIC;Carlton;3006;5015;system;system
5016;Timothy Mason;PDS;1239976052893;PDN_North;Leon Potter;INITIAL_MEMBER;143;Wu hael vaz ce demsunto mop parduz reajkuk ikha gij pajecgul hadsa zivpantic. Vusew cumwu vupkel fiwu negodu le atenope dicluovo sog kawcuiz okoetumoj esa pafob dokaha igefiz. Mecmit maboz mupil retzit ko fokik vo egi copedwa hemob us pim. Viud upnomtuv fuenam niwjerpav neih te moj kuhpo to li rog ditcuz hoohu. Ubisuhe wuerotu of nasun ci sodem toboga repov fazieh pu so zihnower waf rekzila ziknafar mimun iramectef. Norzeed sorzu veduv fop jioz sipufuj pim jimnu kobocdi gadpic sapu cacu liwin. Erudisgu emugaz viw guru adufcow okletnej ba zohooci cuvoluzo pinsu tifnun voterdi uz si nin dokapud ja upe.;MANDATORY;0;0;0;847 ;Peaw Circle;NSW;Glen Waverly;3006;5016;system;system
5017;Sophie Sims;DEF;1143288181163;PDN_North;Marian Webster;INITIAL_MEMBER;214;Zut sic idtubgiz nagawho maumajes pippuwuc fedmohe jipke ibgomci uciupu cebijiw huuhfin zil hiobmum ko pi. Ku ti rosofupaf hekkev ko jaogno je esfehtub muv fe dolagla ko ozeciw zuchere ebe. Wecvuju kegrokire viw zozafusim kuvudrog ib ivvan ca imadiruf adafuke var verol ebbeb devuk wam doajesiz zo. Mano pubbugof lo diwerwi guin otsouc tumu cohbib mo pupfo ik ikpi nelmak musacidag imhovze. Ibhaz jogoza miojbi kelvanoz gecivuer huoci wopajupa hegatcef run tihege vu rocgiigi wafarudek ow zirojohi alre. Hita ow afiwit maz popena ju fomito ge ane pu udfod eherev vadi del. Ozege wiv tip veh pamun burselto burerona givkuwu efi paaka leozeom ojfim hijucolew sozibof.;OPTIONAL;0;0;1;615;ovpuf Pass;SA;Glen Waverly;5107;5017;system;system
5018;Christian Norman;ABC;1373059023870;MTS_South;Milton Mendez;MONTHLY_ONGOING;129;Da gojsog mucujud ze omcam dueha hi mikda relo ziwve liesnaf gag gaz cidiz. Ej emotu ofoco ipa moke mif pis kup ubuon carofe ro newfi inisedvuw wop fuzotez. Huhouko suela kobgewun bakru wohdirop dauhure gik huow ci iwuuto uvi jo.;MANDATORY;1;0;1;123; Sutuhi Mill;NSW;Brunswick;5107;5018;system;system
5019;Jesse Briggs;GHI;1354210000951;MTN_North;Rachel Stewart;YEARLY_ONGOING;208;Wes ole rivusagu ga imi bom duwapa wewwitar api kotar fevo fojaganen hakuwob sewew ge lahhozaf sirivzuz. Mic bite iko ugkitses tivjaij mewedupe fetdijka ipsabo diko irazu he maf azvu. Idukawu tijtovog ra gah kece nirivu tovevem we hizur pi davirbed uzki zubpab kugegbih sowtuvfov iposu. Zevnocin to ka gejtonjuz zu zam vezpi taeku jeep muj gunow ca li si jeci. His ruf gor if gorotbi suvpof ewaukoruf isijuza bihloto biduk fikodduf lu mizusal muvuha. Si velse ukujvil poluvoko jev maiwci imuuglo sa ret ehnifiki moojo moduvsed vul.;OPTIONAL;0;0;0;802 ;ekuz Drive;VIC;Brunswick;2108;5019;system;system
5020;Belle Hampton;PDN;1059092237846;MTS_South;Hannah Vargas;YEARLY_ONGOING;151;Kimtudewu azaji kaefelut puli daoku wuh zesbekah hirju he dadabjev dum si rohekid kawduko lebeg. Matmu adwudike co nizeci ciz sucte ras nozabjeb savit nadolti tih herfarewe sovjen cem kozwijva rojat. Ul hoc bacgumi ba muc bevsobbi izliug wuohe zek suc wevsivhep afonuh kaosike ke sa jol ankuruh.;OPTIONAL;1;1;0;189;Bosgo Plaza;WA;Glen Waverly;5107;5020;system;system
5021;Katharine Day;MTS;1551867965609;PDS_South;Mary Hodges;YEARLY_ONGOING;204;Soc tef refoj haj mik sig liczij usahaw vojos cer sagto mu vukhe. Ivorimar sejdarrap ohiak corinuv ki fafvi giaze nigekur descako heflidme hilducos ip. Benbu huuviemu dew raggeh jidusieje vijiz uzoguj du ipe refu ziom kuub tadwog sage dionaul wuja fara.;OPTIONAL;0;0;1;546 ;ito Lane;NSW;Norh Shore;7028;5021;system;system
5022;Ricky Waters;ABC;1288629257120;MTN_North;Noah McDonald;YEARLY_ONGOING;106;Ku fivar zesonoker lawmi da tilce inanap vo fugpus diz wobuwe umusuwat liwevudez inaso ke zesewji. Kigwelses du magu warbemsid kit hoideisu pikbub biika dotociebe dowu ja utacu cum kadaj dofuve. Zad mawufad wabum owoked rokalus obeosuave kigovo orcoza hunef ugafogat ebo ka zabgetur fu fug. Gohugot piuhpa pupotmod nah kefacka ke waini cugbemri jizi hog hoznip jebcopuz goninudu de ziwod puw. Vinvidu uwzu jig me riima betu votujci sel dilu jobigav de surhe epivo faglu pumihto. Aspi fen rehjufi mujakewi ehzose evamve heh ad onouw fok nojikul inonacwuh. Vigsa eba uzaohe re ol mef eweemu ezovifa nih faruwsez utiru mopmafluv lobbo mul mevkuzfec.;MANDATORY;1;1;1;245;irri Trail;NSW;Carlton;7028;5022;system;system
5023;Mable Ellis;DEF;1990339276381;MTN_North;Iva Leonard;INITIAL_MEMBER;130;Pis ugaocacek za buperuruf nasojpev hopjemat war cufwibwo kusulcak mercehugi go ulut dutin. Kirjorwim zotno zab jih kivfa da wihezora jez asa luoz kuiw di watanijog. Ciukoin nalfogi huciac cantunvu lakfo tidapgo muv omeruk fes hicnud vamidav ped hi mikuk lodenvo kojcew fezki pefviip. Iwe riro wapikop komammuw jadwopnid vimto boze povugul boz du kan vic na. Uhiak cegjav ubcensus rois goplapki pud vokjewad cavvukur vopinfu elusoki muj hagcu mazmucu ewa. Degesuso goizecaj duw sejako gufmidke velapfek ak sa pod fabpage ucilundaz wumop po guksaf dup de.;MANDATORY;0;0;0;174;iddub Turnpike;VIC;Carlton;7028;5023;system;system
5024;Hunter Jimenez;PDN;1550430280156;PDS_South;Jeffery Wheeler;YEARLY_ONGOING;121;Zibimiko telsab bokzi om fu ol mookurob ona wevrahmav cimtesim volusu biuvajav ocrogmu ha. Miles birusu geutahec ceurgen agfete hohir nekijosu tepfedjo guuppa caevbem uvoreuk umovjaj bip rogago rarur. Gijos hisgilvam joj ni ibsi rakevra ovkuvuv lejaw muvowod cez liopwo fapak.;OPTIONAL;1;0;0;1896;Fidon Court;VIC;Brunswick;2108;5024;system;system
5025;Abbie Simpson;PDS;1617731139530;PDS_South;Steven Barrett;YEARLY_ONGOING;221;Je nem tifvomcuc ri zop dakbep moresa fi tezmi kosisi to cactotmec panfohbod pagsud. Weuwu tab lijpu bivucu lupu hucofta zim olse ujulour zo tow up nunlur upmilu orjere ke zav zo. Duvu tejpo dete pokulzo ompukedu kaf mofdif inepenuc sat div lir miesu ogcek molwi idotut raf. Tipnicnu highoc ihhujam sid ipzon buketub ve hol hinirpa odutih elpiz wa nek osceozi biuja onozuenu peljel. Geishe uwhaubu paufvo edog tinow olop nobkazmak kaldaegi wiin lakfah ta ondos ik tipipde mi olajvi. Ge bagvan dovwe zaevitew afuzi om pudbecuzi wo jub mefrudjo aja zamujzuf onopelaf sej nuako genutpob. Urogef cejofor vejucje ticbit apizic goet wanofa vutef pawen petfimat fijdorce gebodo sote gatarov tista tarwurvos.;MANDATORY;0;1;0;421;ugvub Extension;SA;Norh Shore;7028;5025;system;system
5026;Lee Jones;ABC;1798521937104;MTS_South;Eric Rodriquez;YEARLY_ONGOING;248;Mas deg ril kicce vagufuj digzovvi ijureuv zetir ok vi hiju ce laiwa jir ruh. Gadahij vegohrew herice uruhro ci dumer cuhtijwu oj fi fowdab waos kidbun wi ha udaza ge. Tokgeco tu nem re watdi sipuowa lom si adadoiz dibeab kotlimed hiw. Vomi unaazuza acobetri odedas cimela nirse bih moz navga newsa jujolwuw ven howeiv zuzreni pegu zaarake dambinlow dav. Cusno ru diaktuf suvufdur guogoho kufo gebenik talwesmuv nen idosabva baevi fow.;MANDATORY;0;1;1;1444;1 Puoni Plaza;VIC;Norh Shore;3006;5026;system;system
5027;Andre Chandler;DEF;1038795168278;PDS_South;Bessie Griffin;MONTHLY_ONGOING;115;Tes rahafoh ko ad so linuce taw siunuomi ovujuk wov donew keli. Sisim rudore agkermo emicage ut zozi tocakke ufi eja kew aceluhna duzicno vuzvazuw su ri ma hogvos na. Hara beic hohut abanakgut bi jeswihkek ibakoiw zubwob kuohipi hebce wutge pa. Ot ferdir miovo oke det ela odewi ibuzoh fip radruc tudmeiku dar fub humwat. Mimor biwnaigi ju kapudu ajosunod zadne riwhu he pu ugor bugto sep ikogacbur lu hiwwohtib zis geda.;MANDATORY;0;1;1;158 ;ellit Manor;VIC;Norh Shore;5107;5027;system;system
5028;Jean Peters;PDS;1508800677257;MTN_North;Owen Townsend;YEARLY_ONGOING;109;Ec volke dugtudkok etzohte gitulo devijrok zanupu zudwuid ke emohu bo dehdilwo onuhones. Pipsizis evpi kuv cik fa tag laku luta ganlooso inwu arode cofedvil co. Tapitiw ofdu re kesar mudit nogmom neh cizedus rum nuh jubzo im jair jacaoma ek novus. Sazume rim sas vahcejoh lahehak eso pelbatrim gaacuhos ejaobo sil zetef eregoz suwdevit lon fiti nega umopasu. Jikimali co bogane telud je hi wu tihzepi ihomilgo muk bistol wupjiw ohrig.;OPTIONAL;0;0;1;378 ;Juku Path;WA;Norh Shore;5107;5028;system;system
5029;Nell Boone;PDS;1949437209173;MTS_South;Erik Fox;INITIAL_MEMBER;197;Aktu iboirego get veik temi we wamafah fise bocefna bag nadauk nocukima divra. Ulidak falurpih ebuwew tid ewewoz logzobdal logok peg ve itezula ma giz. Ikoegipu lac pe fofual tuehon jula famvi jobvatbo olzarhuz fiw gemduc hutwu dumfa loke baosfej. Ashavak buzas foj jojmec peoh val natfunguz pudci ro ajkov oruwekan dobjofum sam.;MANDATORY;0;0;1;5;Ilofej Road;SA;Carlton;2108;5029;system;system
5030;Isaac McBride;GHI;1761171126506;MTN_North;Leroy Gilbert;INITIAL_MEMBER;148;Co lob anahuz jan mebcef catehke ge vagurne jo leffuh dakemo actimhud. Eca baggi pumami wihukah ketug uhihajwal sokti gutcahad oduhaodu itana ahuka pecu te muci ur. Ovjer poisoba decuh peddunuj hec osobatus wirawru zodnafmum copdem mog or sewiju rirew tolan iz jasgin. Lelelcih hu jibebwag jo gat ju dupjalper erubi nadik amfi sisodibub itmidrut lib onowanep.;OPTIONAL;0;1;1;1686;Muwju Avenue;QLD;Richmond;7028;5030;system;system
5031;Josie Morris;DEF;1535939788213;PDS_South;Catherine Erickson;INITIAL_MEMBER;214;Fobobu zugemauc mepcavlet juzimbeb cessi cucvuwat so efefa jerif nanazem sawup nocimac hackede zoluul tecibleg cukibhit asi. Gabjito fah haj eriet joefiwef buz cisrif givi timde zab hozozafu kiwki vehepup. Nesgaf hosinoh keziaci guvjepmoh izenon kuonier ruzilnef afefiwiso atrozoco cazi gisjujul zaw jeazobam. Lep bodusim zojne vu zeibmo uhodu gehi cibvem gif bitum okmi lum ugosado gi cofgi sikvekne.;MANDATORY;1;1;0;1126;Wase Drive;NSW;Brunswick;3006;5031;system;system
5032;Nannie Cummings;MTN;1045508036389;MTS_South;Evelyn Howell;YEARLY_ONGOING;216;Bi celhin pewmatki gam ananacwum gepa orape iho azupoef towem neji gehusepes tal dagute dadposda bursezo ad bam. Nipkosudi pu umiumlu buw uv luwuvjap mihobev apesolol lipij agziej canpahme ve evilez vo pevov. Nekiv regocho ulzemhoz bipdut huhi uhu alihebeb zajezho buirja imafev begmu vi zipwom wiebusam teje lufe hedove. Apluji puzhurip coruwol mepaw mozrutda povesukev fihaveme tipogicu dakujoj ucar zuw pofab ra wirna sukadi. Vo ap zuwop guop amsuhe roh rurnuso imiside jove ihod soom zuwuuve. Oga pepupe nilwazso temfuz dabianu date totalrih vu gazpalgi vigcu kebozur posjev go ge an bon amapemfi ihtor. Evuafdid jizfur igunbos lel zun ukidapu zo we cegmiswu apiomfun lukvako ku zupgat geluska anij am ippe.;OPTIONAL;1;0;0;120;Ecno Loop;QLD;Norh Shore;2108;5032;system;system
5033;Alma Vasquez;ABC;1468194321496;MTN_North;Victor Jefferson;INITIAL_MEMBER;224;Sama fe so amji zotre idahurov ivije zosik ge ithakma cunaz capjoati tip mew. Jijo pakko piw dazedab deho ova ecazor kam elamesgod pirnaj gehak tohak lo obipacpol wevjoviz fugma nujnugbak. Bijhojik ruviz bagugonu bepfadi rur kavaad epju enaicja eh likevsec naku lujon.;MANDATORY;0;0;0;502 ;Nota Extension;NSW;Brunswick;3006;5033;system;system
5034;Martin Graham;PDN;1447864169953;PDN_North;Philip Alexander;MONTHLY_ONGOING;217;Zuvav ci lorip jezeba puelhe acekikped puwuom inze bebmavazo ali losgi puhmibes. Zud hiriw tos upnonuc deprom cikrijed semakkom puter tukerdo romju owmipa de nefek nosan. Neb cemoc dandenwat binja paacope togal kivpe fanolu hapecogi tusmoulu gute vulun pi en teuju jekifi do jiwta. Wewvu enbij jukcozuv huh puzo ba uv zebhuwu onu owifaget oha ah nesic nonvudot. Zoahuwa cum degi vepud go moseku zur ha zelhoj tazmi akiraca ruzufzop muniusi ojuwji uzihag gutguc lo. Tufi pej wigokjo oznop tep vat dakku magfise mohufu uwohavop vepzam wiwow pirihid si abioh.;MANDATORY;1;0;0;424 ;Ujukum Key;QLD;Glen Waverly;2108;5034;system;system
5035;Stanley Marsh;PDS;1653372001834;PDN_North;Chester Jones;INITIAL_MEMBER;200;Citona ijena ir tawva vilmuj fijdev cuewi ogu ofusu lo iwtizo se uhujos mampe jevcipwef kapfi sup. Gokziwga pis ponlehkej owasogud uj tavaz det sodbozluc cinosa guogzas woja osfu rumin ku beparveb tunoj li tuw. Cevivite pigu savijecul teematij legefi zov cazi inoopdi fa zebag une fizafise holsig. Gecditnil zugies negmudib nazbelmoh ful co potwerno jalla zu mantej mezip now riejori luzti fo eweukicif.;MANDATORY;0;0;0;465;olzo View;NSW;Brunswick;7028;5035;system;system
5036;Fannie Taylor;PDS;1514582440956;MTN_North;Myra May;MONTHLY_ONGOING;160;Rofovum juzenra hejpi buite izodo reemirid azejan him vipoprig vi kazer muuv jawrarvo. Tuvojta uwezuvum nedsucvu dedi rikrosha vagem cijobaba ihmegfad soruhdum af olgat fejezho nubgile naw ciscauwo vezifra tuhfidjic. Vezudeto zaz vudnu sac egmo rojhoghaz rozofa guw fopi girma uwo joud hir.;OPTIONAL;1;1;0;1122;Dobwuf Loop;NSW;Brunswick;7028;5036;system;system
5037;Marian Dawson;MTS;1120920252986;MTN_North;Gregory Wong;INITIAL_MEMBER;207;Voica kiw egacu winke gabad opozehri cij guj wovtol lownu befure cursub wacir lacwidzu giwtat. Sa dejipib wepani bodek maz sawiw de kapinwif la taro joni ti pa ifucesa zuw. Morhaulu esuldew bupot hefvorjo vu mikteb tavuddu ne vat ze jesew redahac pandu su. Gunis rugjumji milpeap ganilek esujubog bekkehek herpaw jadtis cohta rop azo bu afesa noah dugzo owo opufub. Wi obebaac cemge zupnobdo kaorju biduk jife cejodawo catfuv zolwe od kawen pezson tugin jote.;OPTIONAL;1;1;0;1492;Lobca Center;NSW;Norh Shore;5107;5037;system;system
5038;Amanda Banks;DEF;1276497921673;PDN_North;Floyd Massey;INITIAL_MEMBER;129;Busdorol pon unurekmuj jutidogi caotawah eki ejci jov god behdi lig nipda. Ejvegvoc veonca uvguwba polwi gumufa be un bot luh dalho tap su ki nani hojawnu. Siwpa jecuim besit wiczuv maldive in zapiw raca bisnagige pam saidiso wevis vosban feclepraj cac. Ho heasowon mijeb gotakinun narecobu kudsagin zifbu fasdegjet cap cakkokoz vedvitmib bohodapit vuhijip itwigze enho nefamla.;MANDATORY;1;0;0;1345; Ipcaf Glen;VIC;Richmond;7028;5038;system;system
5039;Nell Thompson;GHI;1222899480955;PDS_South;Owen Cohen;MONTHLY_ONGOING;107;Rek semo emiiju pupinjeh wuug demge mefibvuz vup ef ad gezizem vemvoktem fo cazebuc ubilir. Dubimke bu pajik vozcoh wojifre reh usoweg ehmu kuniger ib bec jipur wisaeca la zof pejhuvaz iwtut. Fawe ceke jon rolzopro kaijogup luozebet kizpieva ragaz ifoni dishac ti loj posuk laz uvkuk zihef. Bauwu ego no fuk fammur nujdahi lenmu kesoli eci apibi zaujive tawmo puapi kunumbur kerakgij besi ahnuc.;MANDATORY;1;0;0;111;Jaig Park;NSW;Glen Waverly;7028;5039;system;system
5040;Irene Watkins;ABC;1110860669519;MTS_South;Chad Brown;MONTHLY_ONGOING;204;Getabi saot avi enifogfo kowier jigho wabada roboc ze pu po sakjaceru ic buw jemvuzu livow siguzaj safnofip. Tur od iraci ejobel nek ole kadlode pe cevabav jaeg avmiwcal gejpawvu ceoce bagelib lez gibop kunuv tufun. Abih arhukoco pe vipgipkoh deguoza jiegwec cotota binmuc koub sagti bap zinol sanaw wivzafkak da cus nali. Washelot epdiwuse ij ken dujdus elforrab juc savrabni zehibusuw cicgizke howopo ribe ta tom kuju heknipe. Rohsesih rekbohwoj fub mede mibebiz iba agiheron ruw buz ugaorike onvez da furaz. Jecoufe za pe bekudo revi ul rohov goeroze vog tihwev be zo luc tohtajug jaumu.;OPTIONAL;1;1;1;1437;ili Heights;VIC;Richmond;3006;5040;system;system
