id;name;billing_code;abn;campaign_code;property_manager;contract_type;subscription_cost;invoice_text;crn_choice;future_subs;is_active;show_offer;address_line1;address_line2;state;suburb;postcode;partner_id;created_by;last_modified_by
5127;Ada Guzman;GHI;1102561746025;MTN_North;Shane Bennett;INITIAL_MEMBER;168;Egohapte zahguf cinkoluv su avofi ban kuhsed ler bojilveg nidvezod gufup vib. Seulo bedewu co jibuw veka modebej iguemo ded nu ke dovila giz pape monwes tef cinaza obbuvte jer. Wo utejejani dozlisu nuwadce afarob ihufi wiku odemuboh motuim ekeviksoz pefwo lug pohigom. Ufi vihtel buzij lubgi voltemov ta luri fivaro gaved su bihwofzo oba zetzupid fawer dococa sagluw.;OPTIONAL;1;0;1;723 ;Uhfuj Lane;QLD;Norh Shore;2108;5027;system;system
5128;Ida Klein;PDN;1707854636712;MTN_North;Carl Phelps;INITIAL_MEMBER;140;Epovig poljojtof du uwsivlo vafijuceb li nimate epo zacazo rirar doses vitlappi rogsu ezovo. Muatoocu rogjikra man sevev gagesom pefobu ga rego ibub hu jah orakib obapesel huvmope redebogok tir. Veubi dortumet im nascar dosnodi raho cagase vov entogfoh mufej amsok uco ciwvoho. Tulidgi pelog egbej hejrag viv ju nakah bizmi zuop riras mitu cuhvolot ateivodac.;OPTIONAL;1;0;0;1012; Conof Place;QLD;Norh Shore;3006;5028;system;system
5129;Cecilia Harper;DEF;1146979953861;MTS_South;Cameron Townsend;INITIAL_MEMBER;135;Movewema une be cez lazo mer sirnujzi nidbiz fewatbi lefnom nihpi usago buf elebewo. Butat didweda mamu kus jotino kef wid ku haudu rohsijoh roputowe hop ona iho henioce. Sekepalen pulaw dute niji wejibugu izeco ze icubijag ukpelat zuje wocelu ha badeju noj sipeg iskuol. Duddu nitkok cuwiwju dizkun doluh raajzev ek capo cituksew fujnow rokabdu sodap kat ifugojkih fepaf igije los. Ebuko owceebo funreftos fianirub mohbelor logamu izwo cet zuzaseh cez duh muroktum upi gepho ezebav wazig. Dildaehu ircipu li uvuadho zi vimadeh berul civ na ra vaovuic comuej cegjel. Jitbala otkite ba ebwirba rijizedi kizvunti avuma cas macugvi mo zuf ze rop bicokob raf.;MANDATORY;1;1;0;162;Bezi Highway;QLD;Glen Waverly;2108;5029;system;system
5130;Seth Norton;DEF;1061550688231;PDS_South;Francis Hoffman;MONTHLY_ONGOING;213;Ze curdo lun te kewagcad ascah wa gizabaj ihiawari tiriv joowo nuvof hozep esurosu rofpe jagatom tare. Lu fe masmowok ub ta runuwasi muhor huris ile jotuj piwigga febemlu zawhos fuw. Soz otoga pizor semgeuf aw derfe sorvavrew sil aso jew picejuw foglivke. Vo ehla bo ocetefu ifuce hajvam ragfoslin zuhcatuh wad rem gorafpe ik ohlagi zaw tuvoc pejetjut radatuup. Nobubek konpu amowe gahmutmi edobimre arabadi giujumij zip gaheb cinpihta pisba cunlil ojeluj pibuta babciape uv accig. Sev savenon peroz zosjenjib aj lak era zaldic savvokumu paro owu ot bo vilema beb itoicici. Navozu hiosude tiizuufi objacmu teked vurzal ricmat ra pi uheko omekob evwu fahuj nabwahwo de dewci kiv.;OPTIONAL;0;1;0;530; Tiwbo Manor;WA;Brunswick;2108;5030;system;system
5131;Estelle Gutierrez;GHI;1622021904215;MTS_South;Barbara Porter;YEARLY_ONGOING;156;Cajkeskef dufnosis hikuzwa aca furo ahe nuzra ifvo dastum abrig be diceto ozofu men eso. Ew weh nokisen uselak bu elmip gobupru dewabpi waja wujevpup gi sewesdo uwunecaw. Gaful tarpo efeho det uhutof koj kopce bafoesu kifti ocuume ukive ononopu muwinika fokrar giadaki.;MANDATORY;1;1;1;105;Mumhet Parkway;VIC;Carlton;3006;5031;system;system
5132;Andre Osborne;MTS;1273788114078;PDS_South;Harold Richardson;YEARLY_ONGOING;243;Ripu hid ivlujek ap mehcu katwori bizgubiw ursezew jiaso casute gamed wosiz pevha guktor ipjassef ulo. Muzbow argaguh toge nuwduvi utbedsi zihez cehguw upe wih ocpubgo imnobuj do iv zutuiv basoli hiv. Nutecne libdugte holjiric fiffulop dem focgu wulur jovhan ibouci in ufo ra ek citi bu. Bab oha tolvoref te igmen netomon duh cemigziz udu ni jojit sen osujapas zessirmid umbis mofnici goglulep.;MANDATORY;0;1;1;625;dalad Parkway;SA;Norh Shore;7028;5032;system;system
5133;Dollie Saunders;DEF;1973409476923;MTS_South;Isabelle Gonzales;YEARLY_ONGOING;188;Pewnocru lisu mucwan achob weseka lefbat vejicba epolu sulegaoc ecu jih no korfiwse. Sod dehho ti wamhu kumcaj hudado vucawavi cevegcad coshojec an obukuhed juj za valfebka zaid facur be. Ilajelu jorde ceka avojifpu junuw hitu utuzoc imiolulup siniv soorwes daeb siv wohmi mo fagu gup.;MANDATORY;1;1;1;127;Mifpok Center;SA;Carlton;7028;5033;system;system
5134;Jimmy Kennedy;MTS;1907253468642;PDN_North;Michael Gregory;MONTHLY_ONGOING;120;Cuzawni aruge eg apir dabnumomo di goptum begebgo adibeeme enopurha ceboktih dute tu gahbe. Tineh evohavcer ohdivpar jel powe wu aku urufut hemegvod vukzu sa jogugtet ifo mivniva. Ac iw jimi taz lanhe tohfiwiw ep tachiba rubajjis rawon ce wipduh foufoeco jaw vokew. Vegu tede ziv bil wunon kavhetdo ta muhekke noib irisuza gonu vawgejon judaztu. Tupo lih we obpavnap wubul moupe relviv ilarir anola lelewam guriz noseken ki picidudi vi uzuepiik.;OPTIONAL;1;1;1;137;uvreh Place;NSW;Norh Shore;3006;5034;system;system
5135;William Russell;MTS;1590014982969;MTS_South;Bertha Lawson;MONTHLY_ONGOING;225;Jo hi babdan honwo lumijoz nelvipud gajirif nijevfu humiroaf wugoh fi jauwla otakab hiffeot wi tehibim. Faed palfib eluzo ha dozu zez tovrap gugpicep huk sijdifbeg ji bobantig anazut zum rutkaspip adebes. Juviw deifoate igopugli uwu zez isopi embapbuv icvefdo asni ti hugdaawo eju pe bialo. Mojemi uli vokbeb igin owu zibovhod parosti pezlet cukawa kibari ka zoma tuloj feki. Liej cemfefuj akauve vitemwa inaca fop huh falnefka pefzokut mulzur ol ec if lu ohvico ufdi.;OPTIONAL;0;1;1;956;Ocise Turnpike;QLD;Brunswick;7028;5035;system;system
5136;Lloyd Warren;PDS;1084493097616;PDN_North;Angel Reese;YEARLY_ONGOING;141;Zeis sem onga zehohne roc jeuv vium aklechu uchub obo os lo udi zowisu. Uh muno coj measiji si sitolil gilve si waatu ven tupko lopekjal edufe uronuzmaz tu. Legifvi zap ipiceruj owihera behfes nefzazsig lok bomvik heg vol buzor apajooc fo nenranit poha nujracob. Denot begihtap fo natuka woapazoh soruf mujip le lonowi lilor opaso tozuzu huw balfussut rikco manok fu tur. Wagugu kigobis pe etaani fib himivoevi perkefbu gisho nolojeli pilteiro dohuw geboni albov fum. Rosik ju zakduefi ca ehulecop ge ceova nehezoj devap izozez lep temuvpof ohidofa pel afmizfek.;OPTIONAL;0;1;1;1032;Nukof Turnpike;SA;Glen Waverly;2108;5036;system;system
5137;Gabriel Bowen;PDN;1756855608197;MTN_North;Clarence Reid;MONTHLY_ONGOING;191;Ucauvtoz vikin guwmokse folbi mituh lutnil ba dengeluj lannaat ta owrip vabek. Awi pegozi tebogsul huvzecati bojunsoj ta vul dejzuk jud bocahkig if mor. Hok wep ij cifrulkum ipha vizo iloafi saro zovlozfi kenow tiwvuple nub nalar rafofi hohudoj gepabip laz noheriz.;MANDATORY;0;0;0;17;aac Heights;VIC;Brunswick;5107;5037;system;system
5138;Landon Marshall;MTS;1632762362016;MTS_South;Alvin Fernandez;MONTHLY_ONGOING;248;Lescuv zu jutwu obi ujovi irugunud ajzo lobeor dil sisnapdu dozdi com. Wu pupfivbut da olo jobpiluh hu veiviju run in rifi dengeju ime naeruep op buvju rinoger agawefi. Hijar kadbut cactoteb ilhomo casze cu zizloowe sodcefvo we isda fa ac.;MANDATORY;1;0;1;707 ;Zair Key;SA;Norh Shore;5107;5038;system;system
5139;Tyler Lawson;MTN;1764000725467;PDS_South;Leila Rice;INITIAL_MEMBER;133;Fut eda sawweef jetoszoc jon avvusew zu il gi jomuti ubunig uku zatiwu cuecur meki ed dubes howu. Mavmudek fa dusi vafdopca ru lijnop zispu fas zediwi fo ez vamjiev kojnak. Ic bic dim seirlar al re kefzezma aveb racke naulved na na movhu.;MANDATORY;1;0;1;768;abus Way;NSW;Norh Shore;2108;5039;system;system
5140;Daisy Gomez;ABC;1463650362100;PDS_South;Celia Malone;MONTHLY_ONGOING;124;Niale mura sinmiluf ahjakbak zisvikofi demtolgop avu nak sehhoc osi dat zuleci. Be dawmaw vo wowaw okgikot dopo ve jolgijuz tarudi kofmuvel azeha road mo pi. Ci eg atejazab zotbicic jet zeacbu dapizhi pucugof le lin codurira dira uk iti ipmo.;OPTIONAL;0;1;1;28 ;ukove Place;VIC;Richmond;5107;5040;system;system
5141;Clarence Valdez;ABC;1227195819607;PDN_North;Matthew Gibbs;YEARLY_ONGOING;105;Hip fodkawet dosgozbam selfic zobrodsu ki azeszew se ehkuzu jek tat zebul jas rupfecu lodi rad masij. Ofeku te ic rew servuta ja ru gazu wiv rutfuji dovev ebouv abuoc egus rulaotu mu. Muf tavra wov fa fuunso gaseg rad uzki velsor zij jowra ijude red irepuaji tu lan abreji ejawo.;MANDATORY;1;1;1;16;Lotiz Way;WA;Carlton;7028;5041;system;system
5142;Alma Valdez;PDS;1411149860127;PDN_North;Gary Osborne;INITIAL_MEMBER;185;Az pututeci toeva usu sigif ubeup datudru gebal romodu dekicow lelwof pogic fa pirvoteji fake. Wacu mehu atesabsa kutce soema ro buninuzit bal nazos ojoga ola ku. Wivicufuz sewesuro fabpet zaverkus nunafab luec navunzus satiztow eh adco pa faw tokemba sopicad nudta zit subop ustika. Wamid powruife zidacah mihuliba rofhokduw beve vir ma pev cooma umofojuke ba le tebemrov ciberewu hicvaf kedbibvap. Su nalji idvejna sakbud kededot ura wiacuub vojdecug nuwut ochulu nakjutvev beeno zof surij mi. Soec nu ep nir na ilohuzoc mere wutici cu uzpok omrefpac vuwfudwa aneow. Huhucaho miz rube uji wuup ujrecviz ziveb mol am pek cog niba alurow.;MANDATORY;1;1;0;1397;eztum Heights;NSW;Glen Waverly;2108;5042;system;system
5143;Katharine Welch;PDS;1035797429969;PDS_South;Emily Fleming;YEARLY_ONGOING;149;He bemiceuse lov veluwa wimumigi kir eg di ef vikot iplah azjidbo duw. Akicafpec guasagoz macolo caz emuwivfin wevwa epawa semwip ehiew moibu tu ze raov. Iw fanababo si vi vuhuli zubsioki ucarut fom vok wuwa fub zu nuce ca ozga obokane ja. Ganzo bajno ba wihfe baplacmav veako lu figeto ti ro obpipjec licwerow. Sug utiw cogcac jihel misa taro sibonule woudi defhumi utbip wujog kohachi de iwwenfad gacato.;OPTIONAL;1;1;1;711 ;Fekloj Avenue;NSW;Brunswick;3006;5043;system;system
5144;Eugene Hoffman;ABC;1471437480301;PDS_South;Eric Wolfe;YEARLY_ONGOING;104;Wirhicjo ijad wezemkoj sueja kejha pioca ce ihobe lusgo kucuz la tibe okemu jar. Fow vewo oka tal vi emzoci cidsowsi ni kic vu cufmojew cu devlo. Gozcimtu mo kidapuh oz emi ebilizuw wozvaoca cohkar jiin lotil umdigal cumkahvug pagi izebafap fogjodmi. Pamo maulin miraaci la sosopo zaipo duupi lor leb lofsuce zud olgi zubsujtab kedal rajkeji zuc. Rekhi wepih ci uzeve utu fal hal pez bugle inaciug akuvunus gen if bociw tamejaik. Jida dozo duhil riubuses dugeke hi sicobil arwat wis ipege esaifame womu sunenunef ta kenje sadadi uf.;OPTIONAL;1;1;1;336 ;Relpo Street;WA;Carlton;3006;5044;system;system
5145;Carrie Jensen;MTS;1912534835749;MTN_North;Lottie Hernandez;MONTHLY_ONGOING;106;Vaim pow mob vunmaul wam diclanboh unebuc kazeva ejeezoko baoze olimin we iv. Foukpa fil zod radiluek panpiklus tijbu ufcav vazne vakgaszo pav ekhi iromimpa maap famodi. Hu gil egmapaz sip coj kipzosu voop mowet caanika bidnu nacle cobo epuam sah pali mopivef raffo. Paineto he jel odicargar gituwnu ogi usvacu hirtafsen ewuposaf ihlal cehawke jef zowlokpal bopezog lu tuc. Dorol maf boili nuhuvla hukfiv ki zokot juulwi ragfewras ahda cassec ko utde zalpu itazi se mukbu. Cuwij hircode huwib zooslo jifda ubein cadcib mocab deiz ulo kote gu kevuacu harva maoho. Utbi hihku sop siku fezli cunib toesi hi pepwiem wul waca med jihappo ijutoli ovi kazagiko zudem.;OPTIONAL;0;1;1;997 ;ssih Ridge;VIC;Brunswick;7028;5045;system;system
5146;Cody Dawson;PDN;1451505139703;MTN_North;Dennis Weaver;MONTHLY_ONGOING;160;Vepwoc agto emped dirlivnar hegni danvokinu fu jiwpawe cu zut du ebouveune nofpo poze. Veer henru kulkavup afi fujugi ikeb icanifsul opdub soteg wa mit femohol dakep teommos ge ovje ubusejil wan. Avsihoh wahroj lifmo duzsocah leip hup luniz sukic fi zekifjen ma vozvid fupkupko. Ligapu wula gotdectuf rikfa acfemic vuz wezzim gutde kizidvap ka pivsivo dimhukbu ja.;OPTIONAL;0;0;0;1628;Wewat Turnpike;SA;Norh Shore;7028;5046;system;system
5147;Randy Nelson;GHI;1498250379693;MTN_North;Edward Massey;INITIAL_MEMBER;224;Dihi patmujis janpince pehbane umtankil hetbi wiljurul zuf bel fookdeb sak guelu weihomep iba dakkun. Zidre nofu kogaf ge uw zo hollogado miggepi he raurecaw kihnetah mup tu ri alafi zeuz. Kuolu zisegik rajem jase girmogij abupeg vew locobik lak zuvtotah hewu indewzuz difjil fealo ponmi su. Ugodo bo idvul isikzo dizrevdo ucusako lupipuf mogiri fujsafbo doshajhig emozeol vosru pi um ukon fihi jepka. Li tifpidbuz do oc co tidu cuujjem wezaer afle si aru rossa um tegeli. Ha nobum paedi sewez pociw boguhopa la he kur giuh cekewoabi uwugerbe ro. Ceg ajuk cal wuv jauk petkaf rinihud owe otu paup dakuc omdu.;MANDATORY;0;0;1;251 ;Pibum Way;WA;Norh Shore;3006;5047;system;system
5148;Nancy Tate;PDN;1883784321603;MTS_South;Leona Franklin;YEARLY_ONGOING;219;Vijvotro izbuv bulehubi kelodve hatic nab jab abe muh ak zu mufimat piduvisu apame veksalo bu se. Jes zazub sudcicwu asrisu jikajomu huopa kabhad rimtu mekeru toj wadeg cu go vuwad kek. Ze jajzijhih ruvwiuc ici iwkedla ruha zudul ranfezas bogidne hi busileoho pa kanojed wiprot reni lalol. Lis aplo fuulak vive lisuvmo mewju lala we wet bemokah ropjogol zo efamfe teiriwo. Fiipunap sed hamedo wa ivoweapa pa mo ehtuur fo wu wutpuw barute muhak wuirotab kuabi ramafvid. Majiw be cuhcon le romkupi embo sob te jivpeged gubuc levug wilirew kup. Usijolwu buc atuhi ciikop non rahe hiwa wokebkeh cev vocmeiza di re roirmu jazjirvo cimjuje zed.;OPTIONAL;1;0;0;1733;Hekese Plaza;SA;Carlton;3006;5048;system;system
5149;Lottie Gill;PDN;1683349462459;MTN_North;Arthur Webb;MONTHLY_ONGOING;204;Fehkug tizooc peetcup wob ikuibnis tuhew feh tujijo heh pozeba ecdakam opwitela mo. Tokun cebatneg nuar nid kibeul piruczab gomip cinpiup liw nigifke ovid leprezno rovpatgo fat opeoptab. Poteliez dibdolwug ji oc fo meb fekomew recud etba dec dutavu duha ure kahizrav nej. Noc ce nofil vehirwo anze ib ic cuawuig zu seduic lolgozud he dem nic keali zoghoclel hocohtu jakmus. Ic ri bori zousi bewugsa ano tih mutig no ogoaf atecuz ijjuusi gi kuni subi mul gejti.;MANDATORY;0;1;0;1204;Wahafo Loop;VIC;Carlton;5107;5049;system;system